302337,Airplane,PHILADELPHIA INTL,< 1000 ft,EMB-170,1,1,None,12/05/2010 0:00,No damage,REPUBLIC AIRLINES,Pennsylvania,Approach,None,TRUE,FALSE,NO DMG OR EFFECT ON FLT. CARCASS RECOVERED BY PHL OPS STAFF AFTER REPT OF BIRDSTRIKE OFF OF 9R.,Small,Overcast,European starling,0,5,0,No
302340,Airplane,MONTREAL/PIERRE-ELLIOTT-TRUDEAU INTL,< 1000 ft,GLOBAL EXPRS,1,1,None,12/05/2010 0:00,No damage,BUSINESS,Quebec,Climb,None,FALSE,FALSE,NO DMG.  STRUCK SINGLE BIRD JUST AFTER ROTATION ON RWY 6R AT CYUL AT 1045LCL. NO ABNORMALITIES NOTED AFTER STRIKE. NOTIFIED TOWER OF STRIKE. TOWER ADVISED N711LS CREW OF SMALL BIRD REMAINS FOUND ON RWY INSPN.,Small,Some Cloud,European starling,0,50,0,No
301214,Airplane,SOUTHEAST TEXAS REGIONAL ARPT,< 1000 ft,C-421,1,1,Precautionary Landing,12/05/2010 0:00,Caused damage,BUSINESS,Texas,Climb,None,FALSE,FALSE,JUST AFTER ROTATION CLIMBING THRU OVERCAST LAYER. PAX FROM BACK NOTIFIED ME AND PT TO RT ENG. ALL ENG GAUGES NORMAL BUT VISUAL OF RT ENG A HEAVY LAYER OF OIL ENVELOPING IT AND GUSHING FROM FRONT OF ENG. IMMED REQUESTED RETURN TO KBPT AND ON ROLLOUT SHUR D,Small,Overcast,Unknown bird - small,"1,130",500,0,No
301069,Airplane,TOLEDO EXPRESS ARPT,< 1000 ft,C-560,1,1,None,13/05/2010 0:00,No damage,BUSINESS,Ohio,Climb,Rain,FALSE,FALSE,,Small,Overcast,Unknown bird - small,0,50,0,No
301198,Airplane,CHARLOTTE/DOUGLAS INTL ARPT,< 1000 ft,CL-RJ100/200,1,1,None,13/05/2010 0:00,No damage,PSA AIRLINES,North Carolina,Climb,None,FALSE,FALSE,NOTAM. NO DMG.,Small,No Cloud,Unknown bird - small,0,500,0,No
301790,Airplane,LUBBOCK INTL,< 1000 ft,B-737-300,1,1,None,13/05/2010 0:00,No damage,SOUTHWEST AIRLINES,Texas,Approach,None,FALSE,FALSE,LOCATION REPTD AS 1 NM ON FINAL.  NIGHT WITH LANDING LIGHTS ON SAW A SMALL BIRD MOVE LT TO RT IN FRONT OF US AND HEARD A SMALL THUMP ON LOWER RT SIDE OF A/C. NO OTHER INDICATIONS NOTED. WALKAROUND SAW ONLY FEATHERS JAMMED AGAINST LOWER RT PITOT TUBE AND W,Small,Overcast,Unknown bird - small,0,300,0,Yes
301751,Airplane,BALTIMORE WASH INTL,< 1000 ft,B-737-700,1,1,None,13/05/2010 0:00,No damage,SOUTHWEST AIRLINES,Maryland,Climb,None,FALSE,FALSE,NO DMG. HIT WINDSCREEN.,Small,Some Cloud,American robin,0,10,0,Yes
301199,Airplane,KANSAS CITY INTL,< 1000 ft,EMB-170,1,1,None,13/05/2010 0:00,No damage,REPUBLIC AIRLINES,Missouri,Landing Roll,None,FALSE,FALSE,PILOT REPTD STRIKING ONE SMALL BIRD UPON LANDING.,Small,No Cloud,Unknown bird - small,0,0,0,No
301789,Airplane,KANSAS CITY INTL,< 1000 ft,B-737-700,1,1,None,13/05/2010 0:00,No damage,SOUTHWEST AIRLINES,Missouri,Take-off run,None,FALSE,FALSE,SMALL BIRD SEEN AND HEARD STRIKING FUSELAGE ABOVE F/O WINDSCREEN. ALL ENG PARAMTERS NORMAL AND NO ODOR DETECTED THRU AIR COND SYSTEM. FLT CONT UNEVENTFULLY TO PLANNED DEST (KSTL) WHERE BIRDSTRIKE INSPN PERFORMED BY SW MX. NO DMG NOTED. A/C CONT IN SERVICE,Small,Some Cloud,Unknown bird - small,0,0,0,Yes
301196,Airplane,JOHN F KENNEDY INTL,> 1000 ft,A-320,1,1,None,13/05/2010 0:00,No damage,JETBLUE AIRWAYS,New York,Approach,None,FALSE,FALSE,,Medium,No Cloud,Unknown bird - medium,0,"2,000",0,No
301748,Airplane,SACRAMENTO INTL,> 1000 ft,B-737-300,1,1,None,13/05/2010 0:00,No damage,SOUTHWEST AIRLINES,California,Approach,None,FALSE,FALSE,"WHILE ON VFR ARRIVAL INTO SMF, STRUCK AN OBJECT AT 4000 FT ON RT DOWNWIND TO ARPT. ATIS WARNING. POSTFLT REVEALED A BIRD OF UNKNOWN SIZE HAD STRUCK A/C JUST AFT OF RADOME ON LT SIDE OF FUSELAGE. NO DMG.",Small,No Cloud,Unknown bird - small,0,"4,000",0,Yes
301749,Airplane,INDIANAPOLIS INTL,> 1000 ft,B-737-300,1,1,None,13/05/2010 0:00,No damage,SOUTHWEST AIRLINES,Indiana,Approach,None,FALSE,FALSE,LOCATION REPTD AS APPROX 5 MILES N OF IND. NO DMG.,Small,Some Cloud,Unknown bird - small,0,"3,200",0,Yes
301750,Airplane,LOS ANGELES INTL,> 1000 ft,B-737-700,1,1,None,13/05/2010 0:00,No damage,SOUTHWEST AIRLINES,California,Descent,None,FALSE,FALSE,LOCATION REPTD 35 MILES FROM LAX. ABOVE F/O WINDSCREEN. NO DMG REPTD OR SAMPLE COLLECTED BY MX. NO DMG REPTD OR SAMPLE COLLECTED BY MX. WS TOLD BY MX THEY DID NOT KNOW THAT BLOOD OR SNARGE SAMPLES COULD BE COLLECTED FOR ID. A/C OUT OF SERV TIME REPTD AS 4,Small,Some Cloud,Unknown bird - small,"9,754","10,000",0,Yes
302343,Airplane,SALT LAKE CITY INTL,< 1000 ft,MD-83,1,1,None,13/05/2010 0:00,No damage,AMERICAN AIRLINES,Utah,Take-off run,None,TRUE,FALSE,5000 FT REM.,Small,Some Cloud,Horned lark,0,0,0,No
301788,Airplane,SALT LAKE CITY INTL,< 1000 ft,CL-RJ100/200,1,1,None,13/05/2010 0:00,No damage,SKYWEST AIRLINES,Utah,Approach,None,TRUE,TRUE,ID BY SMITHSONIAN. FAA 4329. DNA. FINAL APRCH. REPTD BIRDSTRIKE ON RWY 34L. FOUND REMAINS ONLY BLOOD ON A/C.,Small,Some Cloud,Cliff swallow,0,100,0,No
301072,Airplane,KANSAS CITY INTL,< 1000 ft,DC-9-30,1,1,None,13/05/2010 0:00,No damage,DELTA AIR LINES,Missouri,Take-off run,None,TRUE,TRUE,"ID BY SMITHSONIAN. FAA 4358. WHOLE FEATHER. AT ROTATION, REAR WHEELS STILL ON GRND.",Small,No Cloud,Cliff swallow,0,0,0,No
301200,Airplane,KANSAS CITY INTL,< 1000 ft,EMB-170,1,1,None,13/05/2010 0:00,No damage,REPUBLIC AIRLINES,Missouri,Landing Roll,None,TRUE,TRUE,"ID BY SMITHSONIAN, FAA 4397.",Small,Overcast,Purple martin,0,0,0,No
301757,Airplane,KANSAS CITY INTL,< 1000 ft,EMB-190,1,1,None,13/05/2010 0:00,No damage,REPUBLIC AIRLINES,Missouri,Landing Roll,Rain,TRUE,TRUE,"ID BY SMITHSONIAN, FAA 4365. WHOLE FEATHER. NO DMG OR EVIDENCE OF STRIKE FOUND ON A/C. BIRD FIRST REPTD AS STARLING.",Small,Some Cloud,Savannah sparrow,0,0,0,No
301067,Airplane,CHARLES DE GAULLE,< 1000 ft,B-777-300,1,1,None,13/05/2010 0:00,No damage,AMERICAN AIRLINES,N/A,Approach,None,FALSE,FALSE,STRUCK SMALL BIRD IN LANDING FLARE ON NOSE OF A/C.,Small,Some Cloud,Unknown bird - small,0,10,0,No
301364,Airplane,ALBUQUERQUE INTL,> 1000 ft,B-737-500,1,1,None,14/05/2010 0:00,No damage,SOUTHWEST AIRLINES,New Mexico,Descent,None,FALSE,FALSE,"LOCATION REPTD AS 15NM W, DESCENDING. LOUD THUMP ON F/O SIDE OF A/C FRWD FLT DECK. DID NOT SEE DUE TO LATE NIGHT APRCH. F/O CONFIRMED BLOOD STREAK ON LOWER RT SIDE OF RADOME. NO REMAINS. CONTRACT MX CALLED TO INSPECT. NO DMG .",Small,No Cloud,Unknown bird - small,0,"10,000",0,Yes
302350,Airplane,DALLAS/FORT WORTH INTL ARPT,> 1000 ft,A-319,1,1,None,14/05/2010 0:00,No damage,FRONTIER AIRLINES,Texas,Approach,None,FALSE,FALSE,NEAR ZINGG INTXN.,Small,Some Cloud,Unknown bird - small,0,"3,000",0,No
301367,Airplane,MINETA SAN JOSE INTL,> 1000 ft,B-737-700,1,1,None,14/05/2010 0:00,No damage,SOUTHWEST AIRLINES,California,Approach,None,FALSE,FALSE,KLIDE WAYPT APRCH 30L. NO DMG.,Small,Some Cloud,Unknown bird - small,0,"5,000",0,Yes
301966,Airplane,RALEIGH-DURHAM INTL,> 1000 ft,EMB-135,1,1,None,14/05/2010 0:00,No damage,AMERICAN EAGLE AIRLINES,North Carolina,Approach,None,FALSE,FALSE,BIRDS ON ATIS.,Small,Some Cloud,Unknown bird - small,0,"2,300",0,No
302053,Airplane,BOISE AIR TERMINAL/GOWEN FIELD,< 1000 ft,A-319,1,1,None,15/05/2010 0:00,No damage,US AIRWAYS,Idaho,Take-off run,None,FALSE,FALSE,ROTATION AT TOP OF GLARE SHIELD.,Small,No Cloud,Unknown bird - small,0,0,0,No
301795,Airplane,ALBANY INTL,< 1000 ft,EMB-170,1,1,None,15/05/2010 0:00,No damage,REPUBLIC AIRLINES,New York,Landing Roll,None,FALSE,FALSE,POSSIBLY MOURNING DOVE OR PIGEON. SMALL AMT OF SNARGE OBSERVED ON UPPER LT WINDSCREEN.,Medium,Some Cloud,Unknown bird - medium,0,0,0,No
301800,Airplane,KANSAS CITY INTL,< 1000 ft,B-737-300,1,1,None,15/05/2010 0:00,No damage,SOUTHWEST AIRLINES,Missouri,Landing Roll,None,FALSE,FALSE,POSSIBLY A STARLING.,Small,Overcast,Unknown bird - small,0,0,0,Yes
302047,Airplane,DALLAS LOVE FIELD ARPT,< 1000 ft,B-737-300,1,1,None,15/05/2010 0:00,No damage,SOUTHWEST AIRLINES,Texas,Climb,None,FALSE,FALSE,HIT FUSELAGE JUST ABOVE FRWD WINDSHIELD ABOUT THE CENTER. AFTER CONT FLT TO OKLAHOMA CITY. SAW NO DMG OR MARK(S) WHERE WE THOUGHT BIT HIT A/C.,Medium,Some Cloud,Unknown bird - medium,0,500,0,Yes
302357,Airplane,EPPLEY AIRFIELD,< 1000 ft,A-319,1,1,None,15/05/2010 0:00,No damage,DELTA AIR LINES,Nebraska,Landing Roll,None,FALSE,FALSE,,Small,No Cloud,Barn swallow,0,0,0,No
301799,Airplane,PORTLAND INTL (OR),< 1000 ft,B-737-700,1,1,None,15/05/2010 0:00,No damage,SOUTHWEST AIRLINES,Oregon,Approach,None,FALSE,FALSE,LOCATION REPTD AS 1/4 MILE SHORT FINAL. CENTER POST FRWD WINDSCREEN.,Small,Some Cloud,Unknown bird - small,0,300,0,Yes
302049,Airplane,KANSAS CITY INTL,> 1000 ft,B-737-700,1,1,None,15/05/2010 0:00,No damage,SOUTHWEST AIRLINES,Missouri,Approach,None,FALSE,FALSE,LOCATION REPTD AS 12 NM.,Small,Overcast,Unknown bird - small,0,"2,500",0,Yes
301794,Airplane,LONG BEACH-DAUGH FLD,< 1000 ft,A-320,1,1,None,15/05/2010 0:00,No damage,JETBLUE AIRWAYS,California,Approach,None,TRUE,FALSE,SHORT FINAL. NO DMG.,Small,Overcast,Sparrows,0,20,0,No
301798,Airplane,LAGUARDIA NY,> 1000 ft,B-737-700,1,1,None,15/05/2010 0:00,No damage,SOUTHWEST AIRLINES,New York,Approach,None,TRUE,TRUE,ID BY SMITHSONIAN. FAA 4335. LOCATION REPTD AS 4.5 SM.SMALL BIRD STRUCK NOSE AREA OF A/C.,Small,Some Cloud,Ovenbird,0,"2,500",0,Yes
302358,Airplane,REPUBLIC AIRPORT,< 1000 ft,PA-28,1,1,None,15/05/2010 0:00,No damage,BUSINESS,New York,Landing Roll,None,FALSE,FALSE,PILOT STATED WHILE ON L/R HE HEARD/SAW EURO STARLING HIT NOSE/PROP OF A/C. NO REMAINS RECOVERED. NO DMG.,Small,Overcast,European starling,0,0,0,No
302371,Airplane,LOGAN INTL,< 1000 ft,B-737-700,1,1,None,16/05/2010 0:00,No damage,SOUTHWEST AIRLINES,Massachusetts,Approach,None,FALSE,FALSE,INDICATIONS OF BIRDSTRIKE. UPPER PORTION OF RADOME. UPPER CORNER OF CAPT FWD WINDOW. NO DMG NOTED. LOGBK WRITEUP FOR BIRDSTRIKE.,Medium,No Cloud,Unknown bird - medium,0,400,0,Yes
302366,Airplane,DES MOINES INTL,< 1000 ft,CL-RJ100/200,1,1,None,16/05/2010 0:00,No damage,PINNACLE,Iowa,Climb,None,FALSE,FALSE,,Medium,Overcast,Unknown bird - medium,0,300,0,No
302373,Airplane,BRADLEY INTL,< 1000 ft,B-737-700,1,1,None,16/05/2010 0:00,No damage,SOUTHWEST AIRLINES,Connecticut,Approach,None,FALSE,FALSE,FINAL APRCH. UNSEEN BIRD STRUCK JUST ABOVE R-1 WINDSHIELD CAUSING AUDIBLE THUMP BUT LEFT NO DMG AND ONLY A BASEBALL SIZED SMEAR ON A/C.,Small,No Cloud,Unknown bird - small,0,500,0,Yes
301498,,,,BELL-407,,1,,,No damage,,Minnesota,,None,FALSE,FALSE,LOCATION REPTD AS 3NM NE KSTP.,,Some Cloud,Unknown bird - small,0,,0,
301350,Airplane,DANE COUNTY REGIONAL ARPT-TRUAX FLD,< 1000 ft,EMB-135,1,1,None,16/05/2010 0:00,No damage,CHAUTAUQUA AIRLINES,Wisconsin,Landing Roll,None,FALSE,FALSE,,Small,Some Cloud,Sparrows,0,0,0,No
302368,Airplane,LAMBERT-ST LOUIS INTL,< 1000 ft,B-737-300,1,1,None,16/05/2010 0:00,No damage,SOUTHWEST AIRLINES,Missouri,Approach,None,FALSE,FALSE,"SMALL SPARROW MOVING FROM LT TO RT WHILE LANDING. HEARD SLIGHT THUD BOTTOM RT OF A/C. LANDED UNEVENTFULLY, NO EMG PROBLEMS NOR ANOMALY. POSTFLT INSPN SHOWED A BLACK FEATHER STRIKE BOTTOM RT FUSELAGE JUST AFT OF RADOME (NO DMG). BIRD THEN HIT #2 ENG EXTERN",Small,Overcast,Unknown bird - small,0,50,0,Yes
301501,Airplane,LAMBERT-ST LOUIS INTL,< 1000 ft,MD-82,1,1,None,16/05/2010 0:00,No damage,AMERICAN AIRLINES,Missouri,Landing Roll,Rain,FALSE,FALSE,ATIS WARNING.,Small,Overcast,American robin,0,0,0,No
302369,Airplane,NASHVILLE INTL,< 1000 ft,B-737-700,1,1,None,16/05/2010 0:00,No damage,SOUTHWEST AIRLINES,Tennessee,Landing Roll,Rain,FALSE,FALSE,BIRD TRIED TO AVOID IMPACT ON LANDING R/O BUT HIT RADOME. MX INSPN FOUND REMAINS ON RT WINGTIP. A/C TIME OUT OF SERV REPTD AS 0.3 HRS.,Small,Overcast,Unknown bird - small,0,0,0,Yes
302367,Airplane,MANCHESTER AIRPORT,> 1000 ft,B-737-300,1,1,None,16/05/2010 0:00,No damage,SOUTHWEST AIRLINES,New Hampshire,Approach,None,FALSE,FALSE,NO DMG TO A/C. NO SMELLS. LOCATION REPTD AS 4 MILES END OF 35.,Small,No Cloud,Unknown bird - small,0,"1,500",0,Yes
301500,Airplane,BRANSON ARPT,< 1000 ft,B-717-200,1,1,None,16/05/2010 0:00,No damage,AIRTRAN AIRWAYS,Missouri,Take-off run,None,TRUE,FALSE,NO DMG.,Small,Some Cloud,Scissor-tailed flycatcher,0,0,0,No
302370,Airplane,METRO OAKLAND INTL,< 1000 ft,B-737-700,1,1,None,16/05/2010 0:00,No damage,SOUTHWEST AIRLINES,California,Approach,None,TRUE,FALSE,BIRD STRUCK #2 ENG AND WENT INTO FAN AND COMPRESSOR. A/C TIME OUT OF SERV REPTD AS 0.5 HRS.,Medium,Some Cloud,Unknown bird - medium,0,10,0,Yes
302359,Airplane,PORTLAND INTL (OR),< 1000 ft,DHC8 DASH 8,1,1,None,16/05/2010 0:00,No damage,HORIZON AIR,Oregon,Take-off run,None,TRUE,FALSE,PILOT REPTD POSSIBLE STRIKE ON DEPRT TO SEATTLE.,Small,Some Cloud,American kestrel,0,0,0,No
302061,Airplane,MINNEAPOLIS-ST PAUL INTL,> 1000 ft,B-737-700,1,1,None,16/05/2010 0:00,No damage,SOUTHWEST AIRLINES,Minnesota,Approach,None,TRUE,TRUE,"ID BY SMITHSONIAN, FAA 4342, DNA. NEVER SAW BIRD. 1 STRIKE LWR L CORNER OF FWD WINDSHLD. NO DMG. NOTED BLOOD AND GUTS AND AUDIBLE POP SOUND ON IMPACT. (BIRD REPTDS AS ""PIGEON TYPE"")",Small,No Cloud,Nashville warbler,0,"3,000",0,Yes
302376,,,,EC-135,,1,,,No damage,,Pennsylvania,,None,FALSE,FALSE,LOCATION REPTD AS 1.5 MILES FROM HELIPORT. FOUND BLOOD ON POSTFLT. NO DMG.,,Some Cloud,Unknown bird - small,0,,0,
302380,Airplane,LAMBERT-ST LOUIS INTL,< 1000 ft,EMB-135,1,1,None,17/05/2010 0:00,No damage,AMERICAN EAGLE AIRLINES,Missouri,Climb,"Fog, Rain",FALSE,FALSE,ATIS WARNING.,Small,Overcast,Barn swallow,0,10,0,No
302381,,,,EC-130,,1,,,No damage,,Hawaii,,None,FALSE,FALSE,BLUE 17 WAS OUT OF THE ARPT AREA ON CLIMB OUT FOR TOUR OF THE ISLAND WHEN HE HIT A SMALL BIRD. NO DMG TO A/C BUT RETURN TO HELIPORT TO CLEAN WINDSHIELD.,,Some Cloud,Unknown bird - small,0,,0,
302389,Airplane,DENVER INTL AIRPORT,> 1000 ft,B-737-300,1,1,None,17/05/2010 0:00,No damage,SOUTHWEST AIRLINES,Colorado,Climb,None,FALSE,FALSE,NO DMG. NO FOUL SMELL. NO ENG ABNORMALITIES. ALL INDICATIONS NORMAL. NO DMG.,Small,Overcast,Unknown bird - small,0,"2,000",0,Yes
302377,Airplane,ATLANTIC CITY INTL,< 1000 ft,C-172,1,1,None,17/05/2010 0:00,No damage,BUSINESS,New Jersey,Landing Roll,None,TRUE,FALSE,FOUND NEAR INTXN 4/22 AND 13/31.,Small,Overcast,Barn swallow,0,0,0,No
302386,Airplane,HARRISBURG INTL,< 1000 ft,CL-RJ100/200,1,1,None,17/05/2010 0:00,No damage,PINNACLE,Pennsylvania,Landing Roll,Rain,TRUE,FALSE,,Small,Some Cloud,Unknown bird - small,0,0,0,No
302055,Airplane,ORLANDO INTL,< 1000 ft,A-319,1,1,None,17/05/2010 0:00,No damage,UNITED AIRLINES,Florida,Take-off run,None,TRUE,FALSE,ID BY ARPT BIOL. BIRD WAS SEEN AND STRUCK AT ROTATION. NO KNOWN DMG. LOCATION WAS ABOUT 4000 FT FROM APCH END OF RWY. HIT ON LEFT SIDE SOMEWHERE AFT OF COCKPIT.,Small,Some Cloud,Least tern,0,0,0,No
301980,Airplane,LOGAN INTL,< 1000 ft,A-320,1,1,None,17/05/2010 0:00,No damage,JETBLUE AIRWAYS,Massachusetts,Landing Roll,None,TRUE,FALSE,PILOT REPTD STRIKING A BIRD DURING LDG ROLL. OPS FOUND CARCASS,Small,Some Cloud,Blue jay,0,0,0,No
301981,Airplane,JOHN F KENNEDY INTL,< 1000 ft,A-320,1,1,None,17/05/2010 0:00,No damage,JETBLUE AIRWAYS,New York,Approach,None,TRUE,TRUE,"ID BY SMITHSONIAN, FAA 4405. DNA. ATIS WARNING.PILOT STATES HE HEARD A COLLISION WITH BIRD ABOUT 50' BEFORE TOUCHDOWN.",Small,No Cloud,Laughing gull,0,50,0,No
302390,Airplane,EPPLEY AIRFIELD,< 1000 ft,B-737-300,1,1,None,17/05/2010 0:00,No damage,SOUTHWEST AIRLINES,Nebraska,Approach,None,TRUE,TRUE,"ID BY SMITHSONIAN, FAA 4764. MICRO. ID'D AS CHARADRIIDAE.",Small,Overcast,Plovers,0,100,0,Yes
301947,Airplane,CINCINNATI-BLUE ASH ARPT,< 1000 ft,RKWL SHRIKE,1,1,None,17/05/2010 0:00,Caused damage,CENTRAL AIR SOUTHWEST,Ohio,Approach,Rain,FALSE,FALSE,BROKE FRONT NOSE CONE,Small,Some Cloud,Unknown bird - small,0,400,0,No
302054,Airplane,JOHN F KENNEDY INTL,< 1000 ft,A-320,1,1,None,17/05/2010 0:00,Caused damage,JETBLUE AIRWAYS,New York,Approach,None,TRUE,TRUE,"ID BY SMITHSONIAN, FAA 4404. DNA. ATIS WARNING.3 SEPARATE FLOCKS OF 30+. RADOME WAS REPLACED BUT IT WAS REPAIRABLE. A RADAR PRESENTATION WAS BEING MADE AT THE TIME OF THE STRIKE AND COULD BE SEEN ON THE RADAR. WING WAS DENTED BUT ALSO REPAIRABLE.",Medium,No Cloud,Brant,0,200,0,No
301823,Airplane,HOUSTON-HOBBY,< 1000 ft,B-737-700,1,1,None,18/05/2010 0:00,No damage,SOUTHWEST AIRLINES,Texas,Approach,None,FALSE,FALSE,MX INSPECTED A/C UPON ARRIVAL AT GATE. NO DMG FOUND. REPTD AS SMALL BLACK BIRD. SAME PERSON FILED BOTH REPORTS.,Small,No Cloud,Blackbirds,0,100,0,Yes
302065,Airplane,WATERTOWN MUNICIPAL ARPT,> 1000 ft,C-152,1,1,None,18/05/2010 0:00,No damage,BUSINESS,Wisconsin,Descent,None,FALSE,FALSE,NO DMG JUST FEATHERS AND BLOOD REMAINS ON STRUT.,Small,No Cloud,Unknown bird - small,0,"1,200",0,No
302452,Airplane,LAFAYETTE REGIONAL (LA),< 1000 ft,CL-RJ100/200,1,1,None,18/05/2010 0:00,No damage,ATLANTIC SOUTHEAST,Louisiana,Take-off run,None,FALSE,FALSE,"BIRD FLEW INTO RT SIDE OF FUSELAGE ON T/O ROLL. AFTER LDG, FEATHERS AND BLOOD WERE FOUND ON A/C.",Medium,No Cloud,Unknown bird - medium,0,0,0,No
301773,Airplane,BALTIMORE WASH INTL,< 1000 ft,EMB-145,1,1,None,19/05/2010 0:00,No damage,CHAUTAUQUA AIRLINES,Maryland,Landing Roll,None,FALSE,FALSE,STOPPED DEPARTURES AND CIRCLED ARRIVALS TIL RWY 28 CHECKED AND CLEARED.,Small,Overcast,Unknown bird - small,0,0,0,No
301826,Airplane,DALLAS/FORT WORTH INTL ARPT,< 1000 ft,MD-82,1,1,None,19/05/2010 0:00,No damage,AMERICAN AIRLINES,Texas,Approach,None,FALSE,FALSE,"NO DMG. NO INJURIES. LOCATION REPTD AS 3-5 MILES FINAL, TOOK AVG.",Small,Some Cloud,Unknown bird - small,0,"1,000",0,No
301943,,,,AEROS 350,,1,,,No damage,,Arizona,,None,FALSE,FALSE,"ON FINAL APCH AT SUMMIT REGIONAL MED CENTER'S HELIPAD IN SHOW LOW, AZ, A SML DOVE  OR DOVE SIZED BIRDS CAME UP FROM BELOW AND HIT THE A/C NOSE. NORMAL LDG WAS MADE. A/C WAS RELEASED TO MX. INSPN FOUND NO DMG.",,No Cloud,Unknown bird - small,0,,0,
301825,Airplane,JOHN F KENNEDY INTL,< 1000 ft,B-767-300,1,1,None,19/05/2010 0:00,No damage,AMERICAN AIRLINES,New York,Approach,None,FALSE,FALSE,AAL MX CLEANED WINDSHIELD BEFORE A BLOOD SAMPLE COULD BE TAKEN.,Medium,Some Cloud,Unknown bird - medium,0,400,0,Yes
301775,Airplane,BURLINGTON INTL,< 1000 ft,EMB-145,1,1,None,19/05/2010 0:00,No damage,EXPRESSJET (CONTINENTAL EXPRS),Vermont,Approach,None,FALSE,FALSE,,Small,No Cloud,Red-winged blackbird,0,600,0,No
301942,,,,BELL-407,,1,,,No damage,,Louisiana,,None,FALSE,FALSE,NO DMG.,,Some Cloud,Egrets,0,,0,
301774,Airplane,PHOENIX SKY HARBOR,> 1000 ft,B-737-800,1,1,None,19/05/2010 0:00,No damage,DELTA AIR LINES,Arizona,Approach,None,FALSE,FALSE,,Small,No Cloud,Unknown bird - small,0,"3,200",0,Yes
302241,Airplane,YAMPA VALLEY,< 1000 ft,CL-RJ100/200,1,1,None,19/05/2010 0:00,No damage,SKYWEST AIRLINES,Colorado,Take-off run,Rain,TRUE,FALSE,PILOT CALLED UNICOM AND WANTED UNICOM TO CALL UNITED OPS THAT THEY MIGHT HAVE STRUCK A BIRD ON T/O. CRJ WAS W OF A3 CONNECTOR.,Medium,Overcast,Ring-billed gull,0,0,0,No
301827,Airplane,CHICAGO O'HARE INTL ARPT,< 1000 ft,MD-82,1,1,None,19/05/2010 0:00,No damage,AMERICAN AIRLINES,Illinois,Landing Roll,None,TRUE,FALSE,OPS COLLECTED REMAINS. ID BY WS. WS INSPECTED A/C ON THE BLOCKS. NO NOTICEABLE DMG. UNKNOWN WHERE ON THE A/C STRIKE OCCURRED.,Medium,No Cloud,Ring-billed gull,0,0,0,No
301828,Airplane,HARRISBURG INTL,< 1000 ft,CL-RJ100/200,1,1,None,19/05/2010 0:00,No damage,ATLANTIC SOUTHEAST,Pennsylvania,Landing Roll,None,TRUE,FALSE,,Small,Some Cloud,Sparrows,0,0,0,No
302243,Airplane,JACKSONVILLE INTL,> 1000 ft,B-737-300,1,1,None,19/05/2010 0:00,Caused damage,US AIRWAYS,Florida,Approach,None,FALSE,FALSE,STRUCK JUST BELOW F/O WINDSHIELD. WAITING ON DETAILS OF DMG. MINIMAL BY CAPT DESCRIPTION. MX HAS A/C. INSPECTION IN PROGRESS.,Small,No Cloud,European starling,"2,054","3,000",0,Yes
302407,Airplane,PHILADELPHIA INTL,< 1000 ft,B-737-300,1,1,None,20/05/2010 0:00,No damage,SOUTHWEST AIRLINES,Pennsylvania,Approach,None,FALSE,FALSE,,Small,No Cloud,Unknown bird - small,0,300,0,Yes
302409,Airplane,SAN FRANCISCO INTL ARPT,< 1000 ft,B-737-700,1,1,None,20/05/2010 0:00,No damage,SOUTHWEST AIRLINES,California,Climb,None,FALSE,FALSE,A/C INSPECTED. NO DMG. BLOOD AND ENTRAILS CLEANED OFF A/C.,Small,No Cloud,Unknown bird - small,0,300,0,Yes
302404,Airplane,SALT LAKE CITY INTL,< 1000 ft,B-737-700,1,1,None,20/05/2010 0:00,No damage,SOUTHWEST AIRLINES,Utah,Take-off run,None,FALSE,FALSE,"AFTER T/O THRUST WAS SET AND ACCELERATING DOWN RWY, SMELLED ODOR FROM PACKS. ENG INDICATIONS NORMAL AND CONT T/O. SMELL WENT AWAY DURING CLIMBOUT. PERFORMED PRECAUTIONARY WALKAROUND OF ENG AT DEST AND F/O FOUND BIRDSTRIKE. TIME OUT OF SERV 0.5 HRS.",Small,Some Cloud,Unknown bird - small,308,0,0,Yes
302403,Airplane,HOUSTON-HOBBY,< 1000 ft,B-737-700,1,1,None,20/05/2010 0:00,No damage,SOUTHWEST AIRLINES,Texas,Approach,None,FALSE,FALSE,COULD NOT FIND PT OF CONTACT ON A/C.,Small,Some Cloud,Unknown bird - small,0,300,0,Yes
302397,Airplane,LOGAN INTL,< 1000 ft,A-320,1,1,None,20/05/2010 0:00,No damage,JETBLUE AIRWAYS,Massachusetts,Approach,None,FALSE,FALSE,MAY HAVE BEEN A GULL. LOCATION REPTD AS 1/2 MI ON APRCH.,Medium,No Cloud,Unknown bird - medium,0,250,0,No
301949,Airplane,YEAGER ARPT,< 1000 ft,CL-RJ100/200,1,1,None,20/05/2010 0:00,No damage,PSA AIRLINES,West Virginia,Approach,None,FALSE,FALSE,ATIS WARNING. NO DMG.,Small,No Cloud,Unknown bird - small,0,50,0,No
301946,Airplane,KANSAS CITY INTL,< 1000 ft,CL-RJ700,1,1,None,20/05/2010 0:00,No damage,GOJET AIRLINES,Missouri,Approach,Rain,FALSE,FALSE,"PILOT STRUCK POSSIBLE SPARROW. DUE TO RAIN, UNABLE TO COLLECT SPECIMEN. (DATA ENTRY NOTE: REPORTS DIFFER ON ALT, USED WHAT WAS THOUGHT TO BE THE CAPT'S REPORT DATA)",Small,Overcast,Unknown bird - small,0,25,0,No
302402,Airplane,MINNEAPOLIS-ST PAUL INTL,> 1000 ft,CL-RJ100/200,1,1,None,20/05/2010 0:00,No damage,SKYWEST AIRLINES,Minnesota,Approach,None,FALSE,FALSE,NO DMG. UNEVENTFUL LANDING. FINAL APRCH.,Small,No Cloud,Sparrows,0,"1,800",0,No
302410,Airplane,HARRISBURG INTL,< 1000 ft,EMB-145,1,1,None,20/05/2010 0:00,No damage,TRANS STATES AIRLINES,Pennsylvania,Landing Roll,None,TRUE,TRUE,ID BY SMITHSONIAN. FAA 4352. DNA. PILOT REPTD BIRDSTRIKE. NO REMAINS FOUND ON RWY. FEATHERS THAT WERE ON A/C SENT TO SI.,Small,No Cloud,Swainson's thrush,0,0,0,No
302247,Airplane,MINNEAPOLIS-ST PAUL INTL,> 1000 ft,DC-9-50,1,1,None,20/05/2010 0:00,No damage,DELTA AIR LINES,Minnesota,Descent,None,TRUE,TRUE,ID BY SMITHSONIAN. FAA 4355. WHOLE FEATHER. 12-15 MI OUT ON 12L APRCH (TOOK APPROX AVG),Small,Some Cloud,Wood warblers,0,"3,200",0,No
301267,Airplane,ELEFTHERIOS VENIZELOS INTL,< 1000 ft,B-767,1,1,Precautionary Landing,20/05/2010 0:00,Caused damage,US AIRWAYS,N/A,Climb,None,FALSE,FALSE,LEFT ENG DAMAGE. WAS DESCRIBED AS 3 UPPER END FAN BLADES. ENGINE VIBRATION. DIVERTED TO FRA.,Medium,No Cloud,Gulls,0,100,0,Yes
302406,Airplane,TULSA INTL,< 1000 ft,B-737-300,1,1,None,20/05/2010 0:00,No damage,SOUTHWEST AIRLINES,Oklahoma,Take-off run,None,TRUE,TRUE,"ID BY SMITHSONIAN. FAA 4394. FLT CONT TO DEST, DALLAS. SEARCH MADE OF RWY AND BIRD REMAINS FOUND BTWN TWY J3 AND J2. REMAINS FOUND WERE E OF C/L INDICATION THE STRIKE WAS ON THE RT SIDE OF A/C. PARTS FOUND SHOWED BIRD DISMEMBERED. ALL PARTS ON BIRD ON RWY",Small,Some Cloud,Barn swallow,0,0,0,Yes
302418,Airplane,BALTIMORE WASH INTL,> 1000 ft,B-737-300,1,1,None,21/05/2010 0:00,No damage,SOUTHWEST AIRLINES,Maryland,Approach,None,FALSE,FALSE,LOCATION REPTD AS 5NM.,Medium,No Cloud,Unknown bird - medium,0,"3,000",0,Yes
302264,Airplane,GERALD R FORD INTL,< 1000 ft,EMB-135,1,1,None,21/05/2010 0:00,No damage,CHAUTAUQUA AIRLINES,Michigan,Take-off run,None,TRUE,FALSE,CARCASS FOUND INTACT ON RWY NEAR C/L AT TWY M.,Small,Overcast,Horned lark,0,0,0,No
302424,Airplane,SAVANNAH INTL,< 1000 ft,CL-RJ100/200,1,1,None,22/05/2010 0:00,No damage,ATLANTIC SOUTHEAST,Georgia,Approach,None,FALSE,FALSE,LOCATION REPTD AS 2 MILES N OF AIRFIELD.,Medium,Some Cloud,Unknown bird - medium,0,800,0,No
302423,Airplane,CHICAGO O'HARE INTL ARPT,< 1000 ft,B-767-300,1,1,None,22/05/2010 0:00,No damage,AMERICAN AIRLINES,Illinois,Climb,None,FALSE,FALSE,,Small,No Cloud,Unknown bird - small,0,100,0,Yes
302429,Airplane,NEWARK LIBERTY INTL ARPT,< 1000 ft,DHC8 DASH 8,1,1,None,22/05/2010 0:00,No damage,PORTER AIRLINES,New Jersey,Approach,None,FALSE,FALSE,STRIKE INFO REPTD BY RAMP SUPV. NO DMG REPTD.,Small,Some Cloud,Unknown bird - small,0,"1,000",0,No
302432,Airplane,ORLANDO INTL,< 1000 ft,B-737-300,1,1,None,22/05/2010 0:00,No damage,SOUTHWEST AIRLINES,Florida,Approach,None,FALSE,FALSE,,Small,Some Cloud,Unknown bird - small,0,20,0,Yes
302431,Airplane,LUBBOCK INTL,< 1000 ft,B-737-300,1,1,None,22/05/2010 0:00,No damage,SOUTHWEST AIRLINES,Texas,Approach,None,FALSE,FALSE,UNABLE TO FIND PT OF CONTACT WITH A/C.,Small,Some Cloud,Unknown bird - small,0,300,0,Yes
302428,Airplane,CAPITAL CITY (MI),< 1000 ft,CL-RJ100/200,1,1,None,22/05/2010 0:00,No damage,PINNACLE,Michigan,Landing Roll,None,TRUE,FALSE,,Small,No Cloud,Sparrows,0,0,0,No
301954,Airplane,OLYMPIA ARPT,< 1000 ft,BE-35,1,1,None,22/05/2010 0:00,Caused damage,BUSINESS,Washington,Approach,None,FALSE,FALSE,"10"" DENT ON RT WING LEADNG EDGE ABOUT 3' INBD FROM WING TIP.  LARGE HAWK. MINOR SKIN DMG. BIRD WAS DISCARDED BY FBO BEFORE ID COULD BE MADE.",Large,Some Cloud,Hawks,"2,669",10,0,No
302425,Airplane,DILLANT-HOPKINS ARPT,> 1000 ft,HAWKER 800,1,1,None,22/05/2010 0:00,Caused damage,BUSINESS,New Hampshire,Approach,None,FALSE,FALSE,PILOTS HEARD THUMP SOUND OF BIRDSTRIKE ON RADOME ON APRCH. NIGHT CONDITIONS SO THERE WAS NO VISUAL OF BIRDS. SUBSEQUENT APRCH UNEVENTFUL. POSTFLT REVEALED ENG DMG FROM INGESTED BIRD. ENG REMOVED.,Medium,No Cloud,Unknown bird - medium,"12,320","2,000",0,No
302110,Airplane,DALLAS/FORT WORTH INTL ARPT,< 1000 ft,B-757-200,1,1,None,23/05/2010 0:00,No damage,AMERICAN AIRLINES,Texas,Approach,None,FALSE,FALSE,NO APPARENT DMG.,Small,Some Cloud,Blackbirds,0,800,0,Yes
301957,Airplane,NASHVILLE INTL,< 1000 ft,B-737-700,1,1,None,23/05/2010 0:00,No damage,SOUTHWEST AIRLINES,Tennessee,Climb,None,FALSE,FALSE,NO DMG. CONTRACT MX REMOVED DEBRIS FROM RADOME UPON LDG. UNKN COST FOR INSPN. BNA TWR WAS ADVISED OF STRIKE & POSSIBLE DEBRIS ON RWY. UNKN IF ANY FOUND. POSSIBLY STARLING.,Small,Some Cloud,Unknown bird - small,0,75,0,Yes
302114,Airplane,OXNARD ARPT,< 1000 ft,EMB-120,1,1,None,23/05/2010 0:00,No damage,SKYWEST AIRLINES,California,Approach,None,TRUE,FALSE,NO DMG TO A/C. BIRD REMOVED FROM RWY.,Small,No Cloud,Sparrows,0,45,0,No
