305812,Airplane,TOLEDO EXPRESS ARPT,< 1000 ft,MD-83,1,1,None,22/08/2010 0:00,No damage,ALLEGIANT AIR,Ohio,Approach,None,FALSE,FALSE,NO DMG,Small,Overcast,Unknown bird - small,0,20,0,No
305821,Airplane,JACKSONVILLE INTL,< 1000 ft,CL-RJ100/200,1,1,None,22/08/2010 0:00,No damage,PINNACLE,Florida,Approach,Rain,FALSE,FALSE,SPLAT ON WINDSHIELD.,Small,Overcast,Unknown bird - small,0,600,0,No
305816,Airplane,YAMPA VALLEY,< 1000 ft,LEARJET-35,1,1,None,22/08/2010 0:00,No damage,BUSINESS,Colorado,Approach,None,TRUE,FALSE,SMALL PART OF BIRD WING MISSING. REST OF BIRD REMAINS WERE INTACT.,Large,Some Cloud,Golden eagle,0,200,0,No
304691,Airplane,THEODORE FRANCIS GREEN STATE,< 1000 ft,C-402,1,1,None,22/08/2010 0:00,No damage,PRIVATELY OWNED,Rhode Island,Approach,Rain,TRUE,FALSE,A/C HIT BIRD WITH LEFT LDG GEAR. NO DMG. OPS STATED BIRD'S RT WING WAS CLIPPED. BIRD STUNNED BUT ALIVE.,Medium,Overcast,Peregrine falcon,0,5,0,No
305824,Airplane,ADAMS FIELD ARPT,< 1000 ft,CL-RJ100/200,1,1,None,22/08/2010 0:00,No damage,SKYWEST AIRLINES,Arkansas,Approach,None,TRUE,FALSE,KILLDEER STRIKE JUST ABOVE WINDSHIELD CAPT SIDE OF A/C ON LANDING. NO DMG TO A/C REPTD.,Small,Some Cloud,Killdeer,0,10,0,No
304688,Airplane,BISMARCK MUNICIPAL ARPT,< 1000 ft,MD-83,1,1,None,22/08/2010 0:00,No damage,ALLEGIANT AIR,North Dakota,Landing Roll,None,TRUE,FALSE,,Medium,No Cloud,Gulls,0,0,0,No
305822,Airplane,BLUE GRASS ARPT,> 1000 ft,CL-RJ100/200,1,1,None,22/08/2010 0:00,No damage,PSA AIRLINES,Kentucky,Approach,None,TRUE,FALSE,,Small,No Cloud,Unknown bird - small,0,"1,020",0,No
305825,Airplane,DALLAS LOVE FIELD ARPT,> 1000 ft,B-737-300,1,1,None,22/08/2010 0:00,No damage,SOUTHWEST AIRLINES,Texas,Climb,None,TRUE,FALSE,VERY SOFT NOISE HEARD ON RADOME. LOCATED REPTD AS 15NM S KDAL.,Small,No Cloud,Unknown bird - small,0,"4,400",0,Yes
304693,Airplane,DES MOINES INTL,< 1000 ft,A-319,1,1,None,22/08/2010 0:00,No damage,UNITED AIRLINES,Iowa,Climb,None,TRUE,TRUE,"ID BY SMITHSONIAN, FAA 4896. DNA. MX COLLECTED REMAINS FROM #1 ENG ON ARRIVAL AT DEN.",Small,No Cloud,Killdeer,0,100,0,No
305830,Airplane,RONALD REAGAN WASHINGTON NATL,< 1000 ft,B-737-800,1,1,None,23/08/2010 0:00,No damage,AMERICAN AIRLINES,DC,Approach,None,FALSE,FALSE,SMEAR DOWN RT SIDE OF FUSELAGE STARTING BELOW RT SIDE WINDOW. NO DMG. NO ENG INGESTION. SHORT FINAL.,Small,Some Cloud,Unknown bird - small,0,200,0,Yes
304858,Airplane,PHILADELPHIA INTL,> 1000 ft,B-737-300,1,1,None,23/08/2010 0:00,No damage,US AIRWAYS,Pennsylvania,Climb,Rain,FALSE,FALSE,NONE NOTICED.,Small,Overcast,Unknown bird - small,0,"10,000",0,Yes
304850,Airplane,OAKLAND COUNTY INTL,< 1000 ft,BE-200 KING,1,1,None,23/08/2010 0:00,No damage,BUSINESS,Michigan,Landing Roll,None,FALSE,FALSE,,Medium,Some Cloud,Unknown bird - medium,0,0,0,No
304853,Airplane,SNOHOMISH CO (PAINE FIELD),< 1000 ft,B-737-700,1,1,None,23/08/2010 0:00,No damage,SOUTHWEST AIRLINES,Washington,Approach,None,FALSE,FALSE,NO DMG. FINAL APRCH.,Medium,No Cloud,Unknown bird - medium,0,600,0,Yes
305828,Airplane,MIAMI INTL,< 1000 ft,B-737-800,1,1,None,23/08/2010 0:00,No damage,AMERICAN AIRLINES,Florida,Climb,None,FALSE,FALSE,DOVE? NO DMG. BLOOD/REMAINS AT PT OF IMPACT THREE INCHES ABOVE F/O WINDSHIELD.,Small,Some Cloud,Unknown bird - small,0,50,0,Yes
304696,Airplane,PRINCEVILLE ARPT,< 1000 ft,C-550,1,1,None,23/08/2010 0:00,No damage,BUSINESS,Hawaii,Landing Roll,None,FALSE,FALSE,SML DOVE HIT RT WING LEADING EDGE ON DI-ICE BOOT. NO DMG.,Small,Some Cloud,Doves,0,0,0,No
304851,Airplane,EPPLEY AIRFIELD,< 1000 ft,CL-RJ100/200,1,1,None,23/08/2010 0:00,No damage,SKYWEST AIRLINES,Nebraska,Take-off run,None,FALSE,FALSE,PILOT STATED BIRD STRUCK AS WHEELS ROTATED.,Small,Some Cloud,Barn swallow,0,0,0,No
304855,Airplane,LAMBERT-ST LOUIS INTL,< 1000 ft,B-737-700,1,1,None,23/08/2010 0:00,No damage,SOUTHWEST AIRLINES,Missouri,Climb,None,FALSE,FALSE,STRUCK WINDSCREEN. ATIS WARNING. NO DMG.,Small,No Cloud,Unknown bird - small,0,"1,000",0,Yes
305784,Airplane,WASHINGTON DULLES INTL ARPT,> 1000 ft,A-320,1,1,None,23/08/2010 0:00,No damage,JETBLUE AIRWAYS,DC,Approach,None,FALSE,FALSE,"NOT OBSERVED, FROM RESIDUE AND SOUND WAS A BIG BIRD. LEVEL AT 3000, 10 MILES N KIAD ENTERING DOWNWING FOR RWY 1R.",Medium,Some Cloud,Unknown bird - medium,0,"3,000",0,No
305783,Airplane,BALTIMORE WASH INTL,< 1000 ft,EMB-190,1,1,None,23/08/2010 0:00,No damage,JETBLUE AIRWAYS,Maryland,Landing Roll,None,TRUE,FALSE,NO REPTD DMG.,Small,No Cloud,Barn swallow,0,0,0,No
304854,Airplane,SALT LAKE CITY INTL,> 1000 ft,B-737-300,1,1,None,23/08/2010 0:00,No damage,SOUTHWEST AIRLINES,Utah,Approach,None,TRUE,FALSE,LOCATION REPTD AS 4.2 MILES.,Small,No Cloud,European starling,0,"1,400",0,Yes
304698,Airplane,BALTIMORE WASH INTL,> 1000 ft,B-737-700,1,1,None,23/08/2010 0:00,No damage,SOUTHWEST AIRLINES,Maryland,Climb,None,TRUE,TRUE,"ID BY SMITHSONIAN, FAA 4754. DNA. GLANCING STRIKE ABOVE AND BEHIND COCKPIT SIDE WINDOWS ON CAPT'S SIDE. REMAINS COLLECTED AT LAX BY WS BIOL. NO DMG REPTD BY MX.",Small,Some Cloud,Chimney swift,0,"1,500",0,Yes
305777,Airplane,GENERAL MITCHELL INTL,< 1000 ft,EMB-145,1,1,None,23/08/2010 0:00,No damage,CHAUTAUQUA AIRLINES,Wisconsin,Landing Roll,None,FALSE,FALSE,ATIS WARNING. NO APPARENT DMG. BIRDS STRUCK CAPT WINDSHIELD.,Small,No Cloud,Unknown bird - small,0,0,0,No
305839,Airplane,MBS INTL,< 1000 ft,CL-RJ100/200,1,1,None,24/08/2010 0:00,No damage,PINNACLE,Michigan,Take-off run,None,FALSE,FALSE,,Small,Overcast,Barn swallow,0,0,0,No
305785,Airplane,DES MOINES INTL,< 1000 ft,EMB-145,1,1,None,24/08/2010 0:00,No damage,AMERICAN EAGLE AIRLINES,Iowa,Landing Roll,None,FALSE,FALSE,TWO BIRDS ON RWY C/L. BIRDS TOOK OFF AND ONE STRUCK NOSE.,Small,Some Cloud,Unknown bird - small,0,0,0,No
304699,Airplane,CHEVRON USA INC SEAPLANE BASE,< 1000 ft,DHC2 BEAVER,1,1,None,24/08/2010 0:00,No damage,BUSINESS,Louisiana,Climb,None,FALSE,FALSE,HIT WING STRUT.,Small,No Cloud,Gulls,0,5,0,No
305837,Airplane,ORLANDO INTL,< 1000 ft,A-320,1,1,None,24/08/2010 0:00,No damage,JETBLUE AIRWAYS,Florida,Landing Roll,None,FALSE,FALSE,"F/O REPTD SEEING SOMETHING, I DID NOT SEE NOR HEAR ANYTHING. DATA ENTRY NOTE: # STRUCK NOT REPTD, ASSUME 1.",Small,Some Cloud,Unknown bird - small,0,0,0,No
304865,Airplane,CHICAGO O'HARE INTL ARPT,< 1000 ft,EMB-145,1,1,None,24/08/2010 0:00,No damage,AMERICAN EAGLE AIRLINES,Illinois,Approach,None,FALSE,FALSE,NO DMG.  SMALL AMT OF RESIDUE REMAINING ON FUSELAGE ABOVE WINDSHIELD.,Small,Some Cloud,Unknown bird - small,0,400,0,No
304703,Airplane,FORT LAUDERDALE/HOLLYWOOD INTL,< 1000 ft,B-737-700,1,1,None,24/08/2010 0:00,No damage,SOUTHWEST AIRLINES,Florida,Approach,None,FALSE,FALSE,ATIS WARNING.  PILOT REPTD SEEING 1 BIRD HIT NOSE OF A/C. INSPN BY MX FOUND NO DMG.,Small,Some Cloud,Unknown bird - small,0,500,0,Yes
305843,Airplane,LOUISVILLE INTL ARPT,> 1000 ft,B-737-700,1,1,None,24/08/2010 0:00,No damage,SOUTHWEST AIRLINES,Kentucky,Approach,None,FALSE,FALSE,BIRD STRUCK FUSELAGE JUST ABOVE CAPT FRWD WINDOW. NO DENTS OR DMG FOUND BY CONTRACT MX. LOCATION REPTD AS 14 NM FROM APRCH END RWY 35L.,Small,No Cloud,Unknown bird - small,0,"6,000",0,Yes
304701,Airplane,METRO OAKLAND INTL,< 1000 ft,B-737-700,1,1,None,24/08/2010 0:00,No damage,SOUTHWEST AIRLINES,California,Landing Roll,None,TRUE,FALSE,LITTLE BLOOD & FEATHERS LEFT ON CAPT'S WINDSHLD. WIPED CLEAN.  STRUCK 2500 DWON RWY. NO DMG REPTD.,Small,No Cloud,Unknown bird - small,0,0,0,Yes
305835,Airplane,SOUTHWEST FLORIDA INTL ARPT,< 1000 ft,MD-88,1,1,None,24/08/2010 0:00,No damage,DELTA AIR LINES,Florida,Approach,Rain,TRUE,FALSE,PILOTS REPTD SEEING A BIRD THEN HEARING IT STRIKE SOMEWHERE ON PORT SIDE OF A/C. NO PHYSICAL INDICATION OF STRIKE FOUND UPON INSPN.,Small,Some Cloud,Barn swallow,0,50,0,No
304860,Airplane,SOUTHWEST FLORIDA INTL ARPT,< 1000 ft,B-717-200,1,1,None,24/08/2010 0:00,No damage,AIRTRAN AIRWAYS,Florida,Take-off run,None,TRUE,FALSE,"APPROX 2000 FT INTO T/O RUN, TRS 927 REPTD A BIRDSTRIKE TO WINDSCREEN. NO DMG. FLT CONT W/O INCIDENT.",Small,Some Cloud,Barn swallow,0,0,0,No
305834,Airplane,SALT LAKE CITY INTL,< 1000 ft,C-182 SKYLAN,1,1,None,24/08/2010 0:00,No damage,GOVERNMENT,Utah,Approach,None,TRUE,TRUE,ID BY SMITHSONIAN. FAA 4788. DNA. PILOT REPTD HITTING ONE SMALL BAT ON 2 MILES FINAL RWY 35. BLOOD SMEAR COLLECTED.,Small,No Cloud,Brazilian free-tailed bat,0,600,0,No
304859,Airplane,LAGUARDIA NY,< 1000 ft,EMB-190,1,1,None,24/08/2010 0:00,No damage,AIR CANADA,New York,Approach,None,TRUE,TRUE,ID BY SMITHSONIAN. FAA 4769. DNA & WHOLE FEATHER. PILOT REPTD STRIKING A MED SIZE BIRD ON SHORT FINAL FOR RWY 4. SNARGE OBSERVED ON L/E OF #1 ENG AND FEATHER REMVD FROM #1 ENG FAN BLADE. NO DMG TO A/C. SNARGE AND FEATHER  SENT TO SI. NO DMG TO ENG LINE.,Small,Overcast,Least sandpiper,0,100,0,No
305857,Airplane,CHICAGO O'HARE INTL ARPT,> 1000 ft,MD-83,1,1,None,25/08/2010 0:00,No damage,AMERICAN AIRLINES,Illinois,Approach,None,FALSE,FALSE,"A/C AT 2300, 160 KS. BLOOD ON A/C AND FEATHERS ON WINDSHIELD WIPERS.",Medium,Some Cloud,Unknown bird - medium,0,"2,300",0,No
304714,Airplane,ORLANDO INTL,< 1000 ft,A-320,1,1,None,25/08/2010 0:00,No damage,JETBLUE AIRWAYS,Florida,Landing Roll,None,FALSE,FALSE,,Small,No Cloud,Unknown bird - small,0,0,0,No
305884,Airplane,PHOENIX SKY HARBOR,< 1000 ft,A-320,1,1,None,25/08/2010 0:00,No damage,US AIRWAYS,Arizona,Climb,None,FALSE,FALSE,CAPT SAW SPLATTER ON WINDSHIELD CAPT LT OB LOWER LT CORNER. DID NOT SEE OR HEAR ANYTHING PRIOR. SAID THEY MIGHT HAVE HEARD A THUD AT ROTATION.,Small,No Cloud,Unknown bird - small,0,40,0,No
305864,Airplane,LOGAN INTL,< 1000 ft,EMB-190,1,1,None,25/08/2010 0:00,No damage,JETBLUE AIRWAYS,Massachusetts,Take-off run,"Fog, Rain",FALSE,FALSE,BIRD STRUCK CAPT UPPER WINDOW FRAME.,Small,Overcast,Unknown bird - small,0,0,0,No
305880,Airplane,LAMBERT-ST LOUIS INTL,> 1000 ft,B-737-300,1,1,None,25/08/2010 0:00,No damage,SOUTHWEST AIRLINES,Missouri,Climb,None,FALSE,FALSE,LOCATION REPTD AS APPROX  5 MILES.,Medium,No Cloud,Unknown bird - medium,0,"3,500",0,Yes
305877,Airplane,CORPUS CHRISTI INTL ARPT,> 1000 ft,B-737-300,1,1,None,25/08/2010 0:00,No damage,SOUTHWEST AIRLINES,Texas,Approach,None,FALSE,FALSE,APPROX 8 MILES NE OF KCRP.,Small,Some Cloud,Unknown bird - small,0,"4,000",0,Yes
305873,Airplane,EPPLEY AIRFIELD,> 1000 ft,CL-RJ700,1,1,None,25/08/2010 0:00,No damage,SKYWEST AIRLINES,Nebraska,Approach,None,FALSE,FALSE,BLACK OR BROWN.,Medium,No Cloud,Unknown bird - medium,0,"3,000",0,No
305869,Airplane,BLUE GRASS ARPT,< 1000 ft,CL-RJ100/200,1,1,None,25/08/2010 0:00,No damage,PINNACLE,Kentucky,Approach,None,TRUE,FALSE,BIRD REPTD AS BLACKBIRD.,Medium,No Cloud,Unknown bird - medium,0,10,0,No
304711,Airplane,CAPE GIRARDEAU MUNICIPAL,< 1000 ft,C-402,1,1,None,25/08/2010 0:00,No damage,CAPE AIR,Missouri,Approach,None,TRUE,FALSE,"I HEARD BIRD HIT NEAR BELLY BUT FOUND NO EVIDENCE. REMAINS FOUND ON RWY. AS WE WERE ON SHORT FINAL, A FLOCK OF BIRDS THAT HAD BEEN SITTING ON THE RWY, TOOK OFF.",Small,No Cloud,Killdeer,0,50,0,No
305868,Airplane,GREATER BINGHAMTON ARPT,< 1000 ft,CL-RJ100/200,1,1,None,25/08/2010 0:00,No damage,PINNACLE,New York,Landing Roll,None,TRUE,FALSE,NO DMG TO A/C. STRUCK SMALL BIRD ON R/O AFTER LANDING.,Small,Overcast,Barn swallow,0,0,0,No
305862,Airplane,SOUTHWEST FLORIDA INTL ARPT,< 1000 ft,BE-400 BJET,1,1,None,25/08/2010 0:00,No damage,FLIGHT OPTIONS,Florida,Landing Roll,None,TRUE,FALSE,,Small,Overcast,Barn swallow,0,0,0,No
305860,Airplane,DETROIT METRO WAYNE COUNTY ARPT,< 1000 ft,DC-9-40,1,1,None,25/08/2010 0:00,No damage,DELTA AIR LINES,Michigan,Landing Roll,None,TRUE,FALSE,"ONE BARN SWALLOW REMVD FROM RWY 21L, BTWN TWY W-4 & F. NO DMG REPTD TO A/C.",Small,Overcast,Barn swallow,0,0,0,No
304709,Airplane,WASHINGTON DULLES INTL ARPT,< 1000 ft,B-737-800,1,1,None,25/08/2010 0:00,No damage,AMERICAN AIRLINES,DC,Take-off run,None,TRUE,TRUE,"ID BY SMITHSONIAN, FAA 4797. WHOLE FEATHER. PILOT REPTD STRIKE TO TWR WHO NOTIFIED ARPT OPS. PEREGRINE FALCON FOUND ON RWY 30 @ 3900' REMAINING. BIRD REMAINS (RT WING) FOUND ON A/C UPON LDG AT DFW. NO DMG.",Medium,Some Cloud,Peregrine falcon,0,0,0,Yes
304712,Airplane,CLEVELAND-HOPKINS INTL ARPT,< 1000 ft,A-300,1,1,None,25/08/2010 0:00,No damage,FEDEX EXPRESS,Ohio,Landing Roll,None,TRUE,TRUE,ID BY SMITHSONIAN. FAA 4875. WHOLE FEATHER. BIRD HIT LEFT SIDE OF NOSE. NO DMG.,Small,No Cloud,Killdeer,0,0,0,No
305859,Airplane,LAGUARDIA NY,< 1000 ft,A-319,1,1,None,25/08/2010 0:00,No damage,DELTA AIR LINES,New York,Approach,None,TRUE,TRUE,ID BY SMITHSONIAN. FAA 4872. DNA. NO DMG. PILOT REPTD STRIKE AT 100 ON SHORT FINAL FOR RWY 31.,Small,Some Cloud,Semipalmated plover,0,100,0,No
305872,Airplane,FORT LAUDERDALE EXECUTIVE ARPT,< 1000 ft,BA-125-700,1,1,None,25/08/2010 0:00,No damage,BUSINESS,Florida,Landing Roll,None,FALSE,FALSE,ATIS WARNING. AFTER LANDING RWY 8 STRUCK A BIRD ON L/R. PILOT REPTD NO DMG TO A/C.,Medium,Some Cloud,Unknown bird - medium,0,0,0,No
305914,Airplane,LAWRENCE MUNICIPAL  ARPT (KS),< 1000 ft,PA-32,1,1,None,26/08/2010 0:00,No damage,UNKNOWN,Kansas,Climb,Rain,FALSE,FALSE,,Large,Overcast,Canada goose,0,50,0,No
305897,Airplane,MINNEAPOLIS-ST PAUL INTL,< 1000 ft,CL-RJ100/200,1,1,None,26/08/2010 0:00,No damage,PINNACLE,Minnesota,Take-off run,None,FALSE,FALSE,ATIS WARNING.,Small,No Cloud,Unknown bird - small,0,0,0,No
305912,Airplane,CHARLOTTE/DOUGLAS INTL ARPT,< 1000 ft,B-737-400,1,1,None,26/08/2010 0:00,No damage,US AIRWAYS,North Carolina,Approach,None,FALSE,FALSE,,Small,Some Cloud,Unknown bird - small,0,"1,000",0,Yes
305910,Airplane,ORLANDO INTL,< 1000 ft,B-737-400,1,1,None,26/08/2010 0:00,No damage,US AIRWAYS,Florida,Take-off run,None,FALSE,FALSE,,Small,Some Cloud,Unknown bird - small,0,0,0,Yes
305900,Airplane,CHARLOTTE/DOUGLAS INTL ARPT,> 1000 ft,CL-RJ700,1,1,None,26/08/2010 0:00,No damage,PSA AIRLINES,North Carolina,Approach,None,FALSE,FALSE,,Medium,No Cloud,Unknown bird - medium,0,"1,900",0,No
304722,Airplane,MONROE COUNTY,< 1000 ft,LEARJET-35,1,1,None,26/08/2010 0:00,No damage,BUSINESS,Indiana,Climb,None,FALSE,FALSE,NO DMG. PREC ENG INSPN AT DESTINATION.,Small,No Cloud,Unknown bird - small,77,200,0,No
304727,Airplane,NASHVILLE INTL,< 1000 ft,A-319,1,1,None,26/08/2010 0:00,No damage,US AIRWAYS,Tennessee,Climb,None,FALSE,FALSE,"TWO REPTD BIRD AS ""BELIEVE STARLING""",Small,No Cloud,European starling,0,100,0,No
305891,Airplane,SANGSTER INTL,< 1000 ft,EMB-190,1,1,None,26/08/2010 0:00,No damage,JETBLUE AIRWAYS,N/A,Take-off run,None,FALSE,FALSE,,Small,No Cloud,Unknown bird - small,0,0,0,No
305905,Airplane,CHICAGO MIDWAY INTL ARPT,< 1000 ft,B-737-700,1,1,None,26/08/2010 0:00,No damage,SOUTHWEST AIRLINES,Illinois,Approach,None,FALSE,FALSE,"DATA ENTRY NOTE: # STRUCK NOT REPTD, ASSUME 1, SAME AS # SEEN.",Small,Some Cloud,Unknown bird - small,0,500,0,Yes
305911,Airplane,LOGAN INTL,< 1000 ft,EMB-190,1,1,None,26/08/2010 0:00,No damage,US AIRWAYS,Massachusetts,Approach,None,FALSE,FALSE,A/C STRUCK SMALL SPARROW LIKE BIRD ON NOSE CONE. NO DMG LIKELY.,Small,Some Cloud,Unknown bird - small,0,40,0,No
305908,Airplane,JACKSONVILLE INTL,< 1000 ft,A-300,1,1,None,26/08/2010 0:00,No damage,UPS AIRLINES,Florida,Take-off run,None,FALSE,FALSE,,Small,Some Cloud,Unknown bird - small,0,0,0,No
304718,Airplane,DALLAS/FORT WORTH INTL ARPT,< 1000 ft,B-737-800,1,1,None,26/08/2010 0:00,No damage,AMERICAN AIRLINES,Texas,Approach,None,FALSE,FALSE,ON FINAL APCH BIRD HIT L FUSELAGE. MX INSPN. NO REMAINS OR DMG FOUND.,Medium,No Cloud,Unknown bird - medium,0,100,0,Yes
305902,Airplane,KANSAS CITY INTL,< 1000 ft,B-737-700,1,1,None,26/08/2010 0:00,No damage,SOUTHWEST AIRLINES,Missouri,Approach,None,FALSE,FALSE,,Small,No Cloud,Unknown bird - small,0,100,0,Yes
304724,,,,EC-135,,1,,,No damage,,Texas,,None,FALSE,FALSE,,,No Cloud,Unknown bird - small,0,,0,
305903,Airplane,SAN ANTONIO INTL,> 1000 ft,B-737-300,1,1,None,26/08/2010 0:00,No damage,SOUTHWEST AIRLINES,Texas,Climb,None,FALSE,FALSE,REMAINS FOUND ON HORIZONTAL STABILIZER ON COPILOTS SIDE. LOOKED LIKE A DOVE.,Medium,Some Cloud,Unknown bird - medium,0,"1,500",0,Yes
305311,Airplane,AUGUSTA STATE,< 1000 ft,CIRRUS SR 20/22,1,1,None,26/08/2010 0:00,No damage,BUSINESS,Maine,Approach,None,TRUE,FALSE,"IMMATURE, FIRST YR HERING GULL.",Medium,Some Cloud,Herring gull,0,6,0,No
305312,Airplane,RENTON MUNICIPAL ARPT,< 1000 ft,RKWLTRBO 690,1,1,None,26/08/2010 0:00,No damage,BUSINESS,Washington,Approach,None,TRUE,FALSE,NO DMG.,Small,Overcast,European starling,0,50,0,No
305889,Airplane,MANCHESTER AIRPORT,< 1000 ft,EMB-145,1,1,None,26/08/2010 0:00,No damage,EXPRESSJET (CONTINENTAL EXPRS),New Hampshire,Approach,None,TRUE,FALSE,,Small,Some Cloud,Mourning dove,0,50,0,No
305886,Airplane,PORTLAND INTL (OR),< 1000 ft,DHC8 DASH 8,1,1,None,26/08/2010 0:00,No damage,AIR CANADA JAZZ,Oregon,Take-off run,None,TRUE,FALSE,PILOT REPTD POSSIBLE STRIKE. AIRFLD SUPV RETRIEVED AMER KESTREL OFF RWY 21.,Small,Some Cloud,American kestrel,0,0,0,No
305895,Airplane,CECIL ARPT,< 1000 ft,B-707,1,1,None,26/08/2010 0:00,No damage,BUSINESS,Florida,Take-off run,None,TRUE,FALSE,ATIS WARNING. NO DMG TO A/C.,Small,Some Cloud,Chimney swift,0,0,0,No
304720,Airplane,GEORGE BUSH INTERCONTINENTAL,< 1000 ft,B-747-400,1,1,None,26/08/2010 0:00,No damage,BRITISH AIRWAYS,Texas,Landing Roll,None,TRUE,FALSE,ATIS WARNING. HIT NOSE CONE. NO DMG.,Small,No Cloud,Killdeer,0,0,0,No
305888,Airplane,LAGUARDIA NY,< 1000 ft,MD-88,1,1,None,26/08/2010 0:00,No damage,DELTA AIR LINES,New York,Approach,None,TRUE,TRUE,"ID BY SMITHSONIAN. FAA 4776. DNA. MICRO. PILOT P CARRAO REPTD STRIKING ONE GULL ON FINAL APRCH TO RWY 31 OVER WATER. VISUAL MARKINGS OF A/C STRUCK IN NOSE CONE, RADOME AND WINDSHIELD. VISUAL INSPN OF A/C PERFORMED BY DAL MX. NO DMG.",Medium,No Cloud,Ring-billed gull,0,200,0,No
305913,Airplane,TULIP CITY ARPT,< 1000 ft,DA-10 FALCON,1,1,None,26/08/2010 0:00,Caused damage,BUSINESS,Michigan,Approach,None,TRUE,TRUE,ID BY SMITHSONIAN. FAA 4771. WHOLE FEATHER. TWO DENTS IN LT INBOARD SLAT.,Medium,No Cloud,Red-tailed hawk,"84,190",5,0,No
305943,Airplane,VANCOUVER INTL,< 1000 ft,A-319,1,1,None,27/08/2010 0:00,No damage,US AIRWAYS,British Columbia,Landing Roll,None,FALSE,FALSE,SMALL BIRD STRUCK LT SIDE OF A/C NOSE AFTER T/D.,Small,Some Cloud,Unknown bird - small,0,0,0,No
305924,Airplane,FORT LAUDERDALE/HOLLYWOOD INTL,< 1000 ft,EMB-190,1,1,None,27/08/2010 0:00,No damage,JETBLUE AIRWAYS,Florida,Climb,None,FALSE,FALSE,BIRDSTRIKE F/O WINDOW.,Medium,No Cloud,Unknown bird - medium,0,50,0,No
305931,Airplane,DALLAS LOVE FIELD ARPT,< 1000 ft,B-737-300,1,1,None,27/08/2010 0:00,No damage,SOUTHWEST AIRLINES,Texas,Approach,None,FALSE,FALSE,,Medium,No Cloud,Unknown bird - medium,0,200,0,Yes
304736,Airplane,TETERBORO AIRPORT,< 1000 ft,C-560,1,1,None,27/08/2010 0:00,No damage,BUSINESS,New Jersey,Approach,None,FALSE,FALSE,NO REMAINS FOUND. PILOT REPTD STRIKE TO ATCT. NO A/C DMG FOUND BY MX INSPN.,Small,Some Cloud,European starling,0,100,0,No
305927,Airplane,GREAT FALLS INTL,< 1000 ft,CL-RJ100/200,1,1,None,27/08/2010 0:00,No damage,SKYWEST AIRLINES,Montana,Landing Roll,None,TRUE,FALSE,PILOT REPTD SEEING THREE GULLS AND STRIKING ONE ON L/R. POINT OF IMPACT ON A/C NOT FOUND. NO DMG. REMAINS FOUND AND POSITIVE ID'S ON RWY.,Medium,No Cloud,Ring-billed gull,0,0,0,No
305928,Airplane,THEODORE FRANCIS GREEN STATE,< 1000 ft,B-737-700,1,1,None,27/08/2010 0:00,No damage,SOUTHWEST AIRLINES,Rhode Island,Approach,None,TRUE,FALSE,KESTREL STRUCK ON RT SIDE OF NOSE. BIRD FOUND HALFWAY BTWN C/L AND RT EDGE LINE OF RWY 2. APROX 3000 FT DOWN RWY.,Small,No Cloud,American kestrel,0,10,0,Yes
305929,Airplane,THEODORE FRANCIS GREEN STATE,< 1000 ft,B-737-700,1,1,None,27/08/2010 0:00,No damage,SOUTHWEST AIRLINES,Rhode Island,Approach,None,TRUE,FALSE,,Small,No Cloud,Unknown bird - small,0,20,0,Yes
304733,Airplane,NEW ORLEANS INTL,< 1000 ft,B-737-900,1,1,None,27/08/2010 0:00,No damage,CONTINENTAL AIRLINES,Louisiana,Climb,None,TRUE,TRUE,"ID BY SMITHSONIAN, FAA 4819. DNA. STRIKE ON L SIDE JUST BELOW CAPT'S WINDOW. STRIKE HAPPENED OVER RWY RIGHT AFTER LIFTOFF. ARPT OPS REPORT STATES REMAINS OF STARLING FOUND.",Small,Some Cloud,Barn swallow,0,20,0,Yes
305926,Airplane,SALT LAKE CITY INTL,< 1000 ft,CL-RJ100/200,1,1,None,27/08/2010 0:00,No damage,SKYWEST AIRLINES,Utah,Approach,Rain,TRUE,TRUE,ID BY SMITHSONIAN. FAA 4786. DNA. MICRO. NO DMG.,Small,Overcast,Killdeer,0,100,0,No
304735,Airplane,ORLANDO INTL,< 1000 ft,A-320,1,1,None,27/08/2010 0:00,No damage,JETBLUE AIRWAYS,Florida,Take-off run,None,TRUE,TRUE,"ID BY SMITHSONIAN, FAA 4928. WHOLE CARCASS. ATCT REPTD JBUT FLT 522 ADVISED A BIRDSTRIKE UPON LDG. 17R. PILOT REPTD BIRD HIT RT WING. NO DMG. FOUND BARN SWALLOW ON RWY. REMAINS FOUND ON NOSE. ATIS WARNING ONLY WHICH DOES US NO GOOD.",Small,Some Cloud,Barn swallow,0,0,0,No
304740,Airplane,RALEIGH-DURHAM INTL,< 1000 ft,B-737-400,1,1,None,27/08/2010 0:00,Caused damage,US AIRWAYS,North Carolina,Approach,None,FALSE,FALSE,"WHILE ON FINAL APCH, DESCENDING THR 800' AGL, A/C HIT A BIG, BLACK BIRD. FLT LANDED SAFELY ABOUT A MINUTE LATER. DENTED RADOME. CREW FLYING IN FROM CLT TO REPAIR.",Large,No Cloud,Unknown bird - large,0,300,0,Yes
305925,Airplane,CHARLOTTE/DOUGLAS INTL ARPT,< 1000 ft,EMB-170,1,1,None,27/08/2010 0:00,No damage,REPUBLIC AIRLINES,North Carolina,Approach,None,FALSE,FALSE,,Small,Some Cloud,European starling,0,250,0,No
305942,Airplane,CHARLOTTE/DOUGLAS INTL ARPT,< 1000 ft,A-319,1,1,None,27/08/2010 0:00,No damage,US AIRWAYS,North Carolina,Approach,None,FALSE,FALSE,,Small,Some Cloud,Unknown bird - small,0,700,0,No
305948,Airplane,LAFAYETTE REGIONAL (LA),< 1000 ft,EMB-145,1,1,None,28/08/2010 0:00,No damage,AMERICAN EAGLE AIRLINES,Louisiana,Landing Roll,None,FALSE,FALSE,NO DMG. BIRD HIT TOP OF NOSE IN FRONT OF WINDSCREEN BTWN WIPERS AND BOUNCED OFF. NUMEROUS OTHER BIRDS AROUND RWY AND TWY.,Small,Some Cloud,Unknown bird - small,0,0,0,No
305947,Airplane,DALLAS/FORT WORTH INTL ARPT,< 1000 ft,MD-83,1,1,None,28/08/2010 0:00,No damage,AMERICAN AIRLINES,Texas,Approach,None,FALSE,FALSE,CENTER WINDSHIELD SPLASHED WITH BIRD REMAINS.,Small,No Cloud,Unknown bird - small,0,400,0,No
304745,Airplane,METRO OAKLAND INTL,> 1000 ft,B-737-700,1,1,None,28/08/2010 0:00,No damage,SOUTHWEST AIRLINES,California,Approach,None,FALSE,FALSE,NO DMG THAT I AM AWARE OF. NIGHTTIME APPCH INTO OAK. FELT THUMP AND HEARD IMPACT OF BIRD ON NOSE AT 4000 FT MSL. NEVER SAW BIRD. MX INSPN AT OAK.,Medium,Some Cloud,Unknown bird - medium,0,"4,000",0,Yes
304759,Airplane,DALLAS/FORT WORTH INTL ARPT,< 1000 ft,A-320,1,1,None,28/08/2010 0:00,No damage,US AIRWAYS,Texas,Take-off run,None,TRUE,FALSE,PIREP OF BIRDSTRIKE ON T/O ROLL ON RWY 17R. RWY WAS CLOSED FROM 0726L TO 0730L FOR INSPN. DEAD KESTREL RETRIEVED AT RWY AND Y INTXN. NO REPT OF DMG.,Small,No Cloud,American kestrel,0,0,0,No
305955,Airplane,HOUSTON-HOBBY,< 1000 ft,B-737-700,1,1,None,28/08/2010 0:00,No damage,SOUTHWEST AIRLINES,Texas,Landing Roll,None,TRUE,FALSE,NO DMG NOTED. BIRD REMAINS REMVD AND SENT TO MX DEPT SUPV.,Small,No Cloud,Unknown bird - small,0,0,0,Yes
305951,Airplane,ROCHESTER INTL,< 1000 ft,CL-RJ100/200,1,1,None,28/08/2010 0:00,No damage,MESABA AIRLINES,Minnesota,Landing Roll,None,TRUE,FALSE,,Small,No Cloud,Unknown bird - small,0,0,0,No
304744,Airplane,CLEVELAND-HOPKINS INTL ARPT,< 1000 ft,EMB-145,1,1,None,28/08/2010 0:00,No damage,EXPRESSJET (CONTINENTAL EXPRS),Ohio,Take-off run,None,TRUE,FALSE,PILOT REPTD STRIKING BIRDS WHILE ROTATING FOR DEPTR. AGENT FOUND REMAINS ON RWY 24L.,Small,No Cloud,Killdeer,0,0,0,No
305950,Airplane,JOHN F KENNEDY INTL,< 1000 ft,EMB-190,1,1,None,28/08/2010 0:00,No damage,JETBLUE AIRWAYS,New York,Take-off run,None,TRUE,FALSE,"BARN SWALLOW CARCASS FOUND ON RWY 4L/22R BTWN 13R/31L AND TWY KB, 75 FT E OF C/L @ 31L-KB. JBU OPS SAID PILOT REPTD RT HAND SIDE (FRONT OFFICERS WINDSHIELD) STRUCK. FLT CONT. NO IMPACT ON FLT. NO DMG REPTD.",Small,No Cloud,Barn swallow,0,0,0,No
304746,Airplane,PHOENIX SKY HARBOR,< 1000 ft,B-737-700,1,1,None,28/08/2010 0:00,No damage,SOUTHWEST AIRLINES,Arizona,Approach,None,TRUE,TRUE,"ID BY SMITHSONIAN, FAA 4815. DNA, MICRO & WHOLE FEATHER. SNARGE WAS IRRADIATED. PILOT REPTD STRIKE ON APCH. OPS COLLECTED SNARGE FROM WINDSHLD.",Small,Some Cloud,Ruby-throated hummingbird,0,"1,000",0,Yes
304747,Airplane,CHICAGO O'HARE INTL ARPT,< 1000 ft,CL-RJ700,1,1,None,28/08/2010 0:00,No damage,SKYWEST AIRLINES,Illinois,Take-off run,None,TRUE,TRUE,"ID BY SMITHSONIAN, FAA 4800 DNA. (DATA ENTRY NOTE: BIRD REPTD AS STARLING.)",Small,No Cloud,Mourning dove,0,0,0,No
305945,Airplane,CHARLOTTE/DOUGLAS INTL ARPT,< 1000 ft,B-717-200,1,1,None,28/08/2010 0:00,No damage,AIRTRAN AIRWAYS,North Carolina,Approach,None,FALSE,FALSE,,Medium,No Cloud,Unknown bird - medium,0,200,0,No
305953,,,,AGUSTA 109,,1,,,No damage,,California,,None,FALSE,FALSE,"WHILE ON C/O KMYA, PASSINE 1000 FT AGL, APPROX 4 MILES SW OF ARPT, NOTICED IN AN INSTANT FLASH A SMALL BIRD, POSSIBLY A SMALL OWL, FLY PAST LOWER LT PORTION OF WINDSHIELD ON COPILOT (LT SIDE) OF HELO. AT THAT SAME INSTANT, OR RATHER GLANCED OFF, THAT SAME",,Overcast,Unknown bird - small,0,,0,
305957,Airplane,NEW ORLEANS INTL,< 1000 ft,MD-88,1,1,None,29/08/2010 0:00,No damage,AMERICAN AIRLINES,Louisiana,Take-off run,Rain,FALSE,FALSE,A/C CONT WITH FLT. 5000 FT REM RWY 19.,Small,Some Cloud,Killdeer,0,0,0,No
305958,Airplane,NEW ORLEANS INTL,< 1000 ft,MD-82,1,1,None,29/08/2010 0:00,No damage,AMERICAN AIRLINES,Louisiana,Landing Roll,None,FALSE,FALSE,PILOT REPTD TO TOWER THAT HE HAD A BIRDSTRIKE ON T/D. RWY INSPN COMPLETED AND NO BIRD REMAINS FOUND ON RWY. AIRCREW HAD LEFT THE AREA AND UNAVIL FOR INTERVIEW. AAL OPS AGNT REPTS TO OPS THAT CAPT ADVISED THAM THAT A SMALL BIRD HAD IMPACTED A/C JUST ABOVE,Small,No Cloud,Unknown bird - small,0,0,0,No
305959,Airplane,NEW ORLEANS INTL,< 1000 ft,MD-82,1,1,None,29/08/2010 0:00,No damage,AMERICAN AIRLINES,Louisiana,Take-off run,Rain,FALSE,FALSE,BIRD REPTD AS STARLING TYPE.,Small,Some Cloud,Unknown bird - small,0,0,0,No
