269211,Airplane,SALT LAKE CITY INTL,< 1000 ft,CL-RJ700,1,1,None,30/10/2009 0:00,No damage,SKYWEST AIRLINES,Utah,Approach,None,TRUE,FALSE,BIRD STRUCK WINDSHIELD. ITS LEG GOT CAUGHT IN WINDSHIELD WIPER THEN THE REST OF THE BIRD HIT THE VERTICAL STAB. NO OBVIOUS DMG. 1 MI APRCH TO SLC FROM SEA.,Medium,Some Cloud,Mallard,0,400,0,No
269223,Airplane,DALLAS/FORT WORTH INTL ARPT,< 1000 ft,EMB-145,1,1,None,30/10/2009 0:00,No damage,AMERICAN EAGLE AIRLINES,Texas,Landing Roll,None,TRUE,FALSE,REMAINS FOUND ON 35C C/L AT M7 C/L.,Small,No Cloud,Mourning dove,0,0,0,No
268083,Airplane,DALLAS/FORT WORTH INTL ARPT,< 1000 ft,EMB-145,1,1,None,30/10/2009 0:00,No damage,AMERICAN EAGLE AIRLINES,Texas,Landing Roll,None,TRUE,FALSE,PIREP OF BIRDSTRIKE RWY 17C/35C. RWY 17C CLOSED FROM 1004L TO 1008L FOR INSPN. A DEAD MEADOWLARK FOUND RWY 17C AND TWY Y INTXN. A/C INSPECTED AT GATE (B21). PART OF WING FOUND ON NOSE LANDING GEAR AND ANOTHER PART OF WINDSHIELD. NO REPT OF DMG.,Small,Some Cloud,Meadowlarks,0,0,0,No
267390,Airplane,DALLAS/FORT WORTH INTL ARPT,< 1000 ft,CL-RJ700,1,1,None,30/10/2009 0:00,No damage,AMERICAN EAGLE AIRLINES,Texas,Landing Roll,None,TRUE,FALSE,FLT 2830 REPTD A BIRDSTRIKE WHILE INBOUND TO DFW. 13R. REPORTED NO DMG. RWY WAS WET FROM PASSING SHOWERS. TWR REPTD BIRDS AT APCH END AND T/O END OF RWY BY THE TREE LINES. REMOVED 1 CARCASS FROM 13R @ A1 HSE INTXN.,Small,Some Cloud,Franklin's gull,0,0,0,No
269210,Airplane,ALBERT J ELLIS,< 1000 ft,CL-RJ700,1,1,None,30/10/2009 0:00,No damage,PSA AIRLINES,North Carolina,Landing Roll,None,TRUE,TRUE,ID BY SMITHSONIAN. FAA 3855. NO DMG. TOUCHDOWN AREA RWY 5.,Small,Overcast,Killdeer,0,0,0,No
269214,Airplane,LONG ISLAND MAC ARTHUR,< 1000 ft,B-737-700,1,1,None,30/10/2009 0:00,No damage,SOUTHWEST AIRLINES,New York,Approach,None,TRUE,TRUE,"ID BY SMITHSONIAN. FAA 3863. ON SHORT FINAL, A/C HIT BIRD WITH NOSE (LOWER LEFT SIDE OF RADOME). NO DMG.",Small,Some Cloud,Horned lark,0,50,0,Yes
268708,Airplane,LAMBERT-ST LOUIS INTL,< 1000 ft,MD-83,1,1,None,31/10/2009 0:00,No damage,AMERICAN AIRLINES,Missouri,Approach,None,FALSE,FALSE,PILOT UNSURE IF DMG OCCURRED. NIGHT FLT. MX HAD NOT YET INSPECTED BELOW THE CENTER WINDSCREEN YET.,Small,Some Cloud,Unknown bird - small,0,900,0,No
268709,Airplane,ERNEST A LOVE FIELD,< 1000 ft,C-172,1,1,None,31/10/2009 0:00,No damage,BUSINESS,Arizona,Approach,None,FALSE,FALSE,NO CHANGE IN A/C PERFORMANCE OR CONTROL. SHORT FINAL.,Small,No Cloud,Unknown bird - small,0,100,0,No
268710,,,,ROBINSON R44,,1,,,No damage,,California,,None,FALSE,FALSE,"NO DMG, INJURIES OR EFFECT ON FLT. BIRD REMAINS NOT FOUND.",,No Cloud,Unknown bird - small,0,,0,
268711,Airplane,JACKSONVILLE INTL,< 1000 ft,EMB-190,1,1,None,31/10/2009 0:00,No damage,JETBLUE AIRWAYS,Florida,Landing Roll,None,FALSE,FALSE,BLOOD ON NOSE OF A/C.,Small,Some Cloud,Unknown bird - small,0,0,0,No
265015,Airplane,LAMBERT-ST LOUIS INTL,> 1000 ft,B-737-700,1,1,None,31/10/2009 0:00,No damage,SOUTHWEST AIRLINES,Missouri,Approach,None,FALSE,FALSE,8 NM L BASE LEG.,Medium,No Cloud,Unknown bird - medium,0,"4,900",0,Yes
265016,Airplane,CHICAGO MIDWAY INTL ARPT,> 1000 ft,B-737-700,1,1,None,31/10/2009 0:00,No damage,SOUTHWEST AIRLINES,Illinois,Approach,None,FALSE,FALSE,,Small,No Cloud,Unknown bird - small,0,"3,500",0,Yes
268256,Airplane,KANSAS CITY INTL,< 1000 ft,B-737-700,1,1,None,31/10/2009 0:00,No damage,SOUTHWEST AIRLINES,Missouri,Climb,None,TRUE,TRUE,"ID BY SMITHSONIAN, FAA 3847, DNA. NO DMG. SWA 1152 ADVISED THEY HIT A BIRD ON WINDSHLD WHILE LDG. NO BIRD WAS FOUND ON RWY INSPN. SAMPLE FEATHERS WERE REMOVED FROM WINDSHLD. BIRD FIRST REPTD AS SPARROW.",Small,No Cloud,Horned lark,0,10,0,Yes
269405,Airplane,MINNEAPOLIS-ST PAUL INTL,> 1000 ft,A-319,1,1,None,31/10/2009 0:00,No damage,NORTHWEST AIRLINES,Minnesota,Approach,None,TRUE,TRUE,"ID BY SMITHSONIAN,FAA 3854, WHOLE FEATHER. ATIS WARNING.",Small,Some Cloud,Cedar waxwing,0,"2,000",0,No
268977,Airplane,BRANSON ARPT,< 1000 ft,B-737-700,1,1,None,31/10/2009 0:00,No damage,SUN COUNTRY AIRLINES,Missouri,Approach,None,FALSE,FALSE,SML BIRD HIT LEADING EDGE OF L WING AS A/C WAS LANDING. NO DMG.,Small,No Cloud,Unknown bird - small,0,10,0,Yes
269180,Airplane,DALLAS/FORT WORTH INTL ARPT,> 1000 ft,MD-83,1,1,None,31/10/2009 0:00,No damage,AMERICAN AIRLINES,Texas,Climb,None,FALSE,FALSE,DEPARTURE END RWY 17R.,Medium,No Cloud,Unknown bird - medium,0,"3,000",0,No
269839,Airplane,ATLANTA INTL,> 1000 ft,CL-RJ100/200,1,1,None,1/11/2009 0:00,No damage,ATLANTIC SOUTHEAST,Georgia,Approach,None,FALSE,FALSE,,Large,No Cloud,Unknown bird - large,0,"5,000",0,No
267232,Airplane,BOLIVAR MUNICIPAL ARPT,< 1000 ft,C-150,1,1,Precautionary Landing,1/11/2009 0:00,No damage,UNKNOWN,Missouri,Climb,None,FALSE,FALSE,BIRD WAS NOT SEEN. FEATHERS FOUND BETWEEN HORIZONTAL STABILIZER AND PLASTIC TIP.,Medium,No Cloud,Unknown bird - medium,0,200,0,No
267976,Airplane,CANYONLANDS FIELD,< 1000 ft,BE-1900,1,1,None,1/11/2009 0:00,No damage,GREAT LAKES AIRLINES,Utah,Approach,None,FALSE,FALSE,,Small,No Cloud,Unknown bird - small,0,5,0,No
269078,Airplane,HILO INTL ARPT,< 1000 ft,CL-RJ100/200,1,1,None,1/11/2009 0:00,No damage,MESA AIRLINES,Hawaii,Approach,None,FALSE,FALSE,,Small,No Cloud,Unknown bird - small,0,20,0,No
264479,Airplane,JACKSONVILLE INTL,< 1000 ft,EMB-190,1,1,None,1/11/2009 0:00,No damage,JETBLUE AIRWAYS,Florida,Landing Roll,None,FALSE,FALSE,BLOOD ON NOSE OF A/C.,Small,No Cloud,Unknown bird - small,0,0,0,No
269849,Airplane,PALM BEACH INTL,< 1000 ft,B-737-700,1,1,None,1/11/2009 0:00,No damage,SOUTHWEST AIRLINES,Florida,Approach,None,FALSE,FALSE,NO REMAINS OR DMG FOUND. DISTANCE REPTD AS: 3SM.,Small,No Cloud,Unknown bird - small,0,"1,000",0,Yes
269838,Airplane,NEWARK LIBERTY INTL ARPT,> 1000 ft,B-767-200,1,1,None,1/11/2009 0:00,No damage,AMERICAN AIRLINES,New Jersey,Approach,None,FALSE,FALSE,IMPACT PT LOWER EDGE OF CAPT #1 WINDOW WITH NO APPARENT DMG.APPROX 18NM SW OF KEWR.,Medium,No Cloud,Unknown bird - medium,0,"6,000",0,Yes
264478,Airplane,JOHN F KENNEDY INTL,> 1000 ft,A-320,1,1,None,1/11/2009 0:00,No damage,JETBLUE AIRWAYS,New York,Approach,None,FALSE,FALSE,SAW A BIRD FLASH IN THE LANDING LIGHTS THEN HEARD A LOUD POP AS IT HIT THE L SIDE OF THE NOSE RADOME. POST FLT SAW BLOOD ON RADOME BUT NO OBVIOUS DMG. BIRD PARTS WERE FOUND IN #1 ENG BUT IT APPEARED TO ONLY TAKE THE BYPASS AND NO OBVIOUS DMG. LOGBK WRITEU,Medium,No Cloud,Unknown bird - medium,0,"3,000",0,No
269627,Airplane,PHILADELPHIA INTL,> 1000 ft,A-320,1,1,None,1/11/2009 0:00,No damage,US AIRWAYS,Pennsylvania,Climb,None,FALSE,FALSE,NO DMG.,Medium,Some Cloud,Unknown bird - medium,0,"4,500",0,No
269625,Airplane,BALTIMORE WASH INTL,> 1000 ft,B-737-700,1,1,None,1/11/2009 0:00,No damage,SOUTHWEST AIRLINES,Maryland,Approach,None,FALSE,FALSE,RWY REPTD AS: ##L. 10 MI FINAL.,Small,Some Cloud,Unknown bird - small,0,"3,500",0,Yes
268963,Airplane,NEWARK LIBERTY INTL ARPT,> 1000 ft,EMB-145,1,1,None,1/11/2009 0:00,No damage,EXPRESSJET (CONTINENTAL EXPRS),New Jersey,Approach,None,FALSE,FALSE,FLT 2868 LANDED ON RWY 4R AFTER STRIKING A BIRD ON FINAL APCH. NO DMG. A/C TAXIED TO RAMP W/O INCIDENT.,Large,Some Cloud,Unknown bird - large,0,"3,000",0,No
269850,Airplane,PORTLAND INTL (OR),> 1000 ft,B-737-700,1,1,None,1/11/2009 0:00,No damage,SOUTHWEST AIRLINES,Oregon,Descent,None,FALSE,FALSE,15 MILES S OF PDX.,Large,No Cloud,Unknown bird - large,0,"6,500",0,Yes
269075,Airplane,NEWARK LIBERTY INTL ARPT,> 1000 ft,EMB-145,1,1,None,1/11/2009 0:00,No damage,EXPRESSJET (CONTINENTAL EXPRS),New Jersey,Approach,None,FALSE,FALSE,"POSSIBLE INGESTION. PILOT WILL REPT IF THERE IS DMG. DATA ENTRY NOTE: # STRUCK NOT REPTD, ASSUME 1, SAME AS # SEEN.",Medium,No Cloud,Unknown bird - medium,0,"1,100",0,No
269841,Airplane,NEWARK LIBERTY INTL ARPT,> 1000 ft,DHC8 DASH 8,1,1,None,1/11/2009 0:00,No damage,COMMUTAIR,New Jersey,Approach,None,FALSE,FALSE,,Medium,No Cloud,Unknown bird - medium,0,"3,000",0,No
269076,Airplane,NEWARK LIBERTY INTL ARPT,> 1000 ft,EMB-145,1,1,None,1/11/2009 0:00,No damage,EXPRESSJET (CONTINENTAL EXPRS),New Jersey,Approach,None,FALSE,FALSE,,Medium,Some Cloud,Unknown bird - medium,0,"2,800",0,No
269080,Airplane,BALTIMORE WASH INTL,> 1000 ft,B-737-700,1,1,None,1/11/2009 0:00,No damage,SOUTHWEST AIRLINES,Maryland,Approach,None,FALSE,FALSE,HEARD STRIKE AT 4000 FT. AFTER LANDING CALLED MX AND FOUND STRIKE OF SMALL/MED SIZED BIRD ON NOSE OF A/C JUST BEHIND RADOME NEAR PITOT TUBES.,Medium,No Cloud,Unknown bird - medium,0,"4,000",0,Yes
269629,Airplane,NEWARK LIBERTY INTL ARPT,> 1000 ft,A-320,1,1,None,1/11/2009 0:00,No damage,US AIRWAYS,New Jersey,Approach,None,FALSE,FALSE,CREW ON A/C 668 REPTD A BIRDSTRIKE ON ARRIVAL INTO EWR VIA ACARS. BIRD HIT RADOME ON R SIDE OF A/C.,Medium,No Cloud,Unknown bird - medium,0,"3,600",0,No
267233,Airplane,GENERAL MITCHELL INTL,> 1000 ft,EMB-170,1,1,None,1/11/2009 0:00,No damage,REPUBLIC AIRLINES,Wisconsin,Approach,None,FALSE,FALSE,A/C WAS ON 4-MILE FINAL FOR 1L.,Medium,No Cloud,Unknown bird - medium,0,"1,500",0,No
269842,Airplane,NEWARK LIBERTY INTL ARPT,> 1000 ft,DHC8 DASH 8,1,1,None,1/11/2009 0:00,No damage,COMMUTAIR,New Jersey,Approach,None,FALSE,FALSE,,Small,No Cloud,Unknown bird - small,0,"3,000",0,No
269848,Airplane,GEORGE BUSH INTERCONTINENTAL,< 1000 ft,EMB-145,1,1,None,1/11/2009 0:00,No damage,EXPRESSJET (CONTINENTAL EXPRS),Texas,Landing Roll,None,TRUE,FALSE,PIREP OF BIRDSTRIKE UPON LANDING RWY 8R. FOUND AND REMVD CARCASS IF AN EASTERN MEADOWLARK AT APPROX 5000 DRM. NO DMG TO A/C.,Small,No Cloud,Eastern meadowlark,0,0,0,No
269081,Airplane,JACKSON EVERS INTL,< 1000 ft,B-737-700,1,1,None,1/11/2009 0:00,No damage,SOUTHWEST AIRLINES,Mississippi,Approach,None,TRUE,FALSE,"BIRD HIT ON EDGE, MOSTLY OUTSIDE EDGE OF #2 ENG NACELLE.",Small,No Cloud,Unknown bird - small,0,500,0,Yes
267280,Airplane,LAGUARDIA NY,> 1000 ft,MD-88,1,1,None,1/11/2009 0:00,No damage,DELTA AIR LINES,New York,Approach,None,TRUE,TRUE,"ID BY SMITHSONIAN, FAA 3933, DNA. STRUCK BIRD ON FINAL. NO DMG.",Small,Some Cloud,American robin,0,"1,500",0,No
267977,Airplane,LAGUARDIA NY,> 1000 ft,A-320,1,1,None,1/11/2009 0:00,No damage,JETBLUE AIRWAYS,New York,Approach,None,TRUE,TRUE,"ID BY SMITHSONIAN, FAA 3930, DNA. BIRDSTRIKE ON FINAL APCH. NO DMG. A/C TAXIED TO RAMP W/O INCIDENT",Small,Some Cloud,Dark-eyed junco,0,"4,000",0,No
269542,Airplane,DANIEL ODUBER QUIROS INTL,< 1000 ft,B-737-800,1,1,None,2/11/2009 0:00,No damage,AMERICAN AIRLINES,N/A,Approach,None,FALSE,FALSE,SHORT FINAL. NO EFFECT ON LANDING.,Small,Some Cloud,Unknown bird - small,0,100,0,Yes
269544,Airplane,CHICAGO MIDWAY INTL ARPT,> 1000 ft,A-319,1,1,None,2/11/2009 0:00,No damage,FRONTIER AIRLINES,Illinois,Approach,None,FALSE,FALSE,HIT ONE BIRD AT NIGHT ON LOWER R SIDE OF NOSE. 30 NM SOUTHWEST.,Medium,No Cloud,Unknown bird - medium,0,"4,000",0,No
268799,Airplane,CHICAGO O'HARE INTL ARPT,> 1000 ft,A-320,1,1,None,2/11/2009 0:00,No damage,USA 3000,Illinois,Approach,None,FALSE,FALSE,"DESCENDING THROUGH 3500 TURNING ON TO FINAL WE HEARD A BANG ON THE LOWER R NOSE OF A/C. DID NOT SEE THE BIRD. NIGHT, VISIBILITY 10 MILES. DATA ENTRY NOTE: # STRUCK NOT REPTD, ASSUME 1.",Small,No Cloud,Unknown bird - small,0,"3,500",0,No
268796,Airplane,PORTLAND INTL (OR),< 1000 ft,B-737-700,1,1,None,2/11/2009 0:00,No damage,SOUTHWEST AIRLINES,Oregon,Climb,None,TRUE,FALSE,CLIMB PDX 2MI EAST.,Small,No Cloud,Unknown bird - small,0,"1,000",0,Yes
268144,Airplane,MINNEAPOLIS-ST PAUL INTL,> 1000 ft,CL-RJ100/200,1,1,None,2/11/2009 0:00,No damage,PINNACLE,Minnesota,Approach,None,TRUE,TRUE,ID BY SMITHSONIAN. FAA 3859. DNA. MICRO. 3 MI FINAL RWY 35 AT APPROX 1500. ATIS CARRIES NOTIFICATION FOR USE CAUTION FOR MIGRATORY BIRDS ON AND IN VICINITY OF ARPT. ARCT INBOUND FROM NASHVILLE. ABOVE PILOTS WINDOW ON ROOF OF FUSELAGE.,Large,Some Cloud,Canada goose,0,"1,500",0,No
269726,Airplane,JOHNSTOWN-CAMBRIA,< 1000 ft,PA-28,1,1,None,2/11/2009 0:00,Caused damage,BUSINESS,Pennsylvania,Landing Roll,None,FALSE,FALSE,"A/C STRUCK A DEER JUST AFTER T/D, DAMAGING TEH PROP, NOSE LDG GEAR AND INBD PART OF RT WING. AS WELL AS EXHAUST TAIL PIPE. A/C WAS CONSIDERED TOTALLED BY INSURANCE COMPANY. WAS SOLD AS IS.  COMPANY THAT PURCHASED A/C SAID IT COULD BE REPAIRED. PHOTOS.",Large,No Cloud,White-tailed deer,0,0,0,No
268686,Airplane,DANE COUNTY REGIONAL ARPT-TRUAX FLD,> 1000 ft,CL-600,1,1,Precautionary Landing,2/11/2009 0:00,Caused damage,BUSINESS,Wisconsin,Climb,None,FALSE,FALSE,2500 FT MSL 5SM NORTH OF MSN. SMALL 6 INCH DENT IN NOSE. RETURNED FOR PRECAUTIONARY LANDING. PILOT ADVISES WILL DEPART AGAIN. BIRD BLACK IN COLOR.,Medium,Some Cloud,Unknown bird - medium,0,"1,600",0,No
268691,Airplane,MIAMI INTL,< 1000 ft,B-757-200,1,1,None,3/11/2009 0:00,No damage,AMERICAN AIRLINES,Florida,Climb,None,FALSE,FALSE,,Small,Some Cloud,Unknown bird - small,0,"1,000",0,Yes
269222,Airplane,YEAGER ARPT,> 1000 ft,LEARJET-31,1,1,Precautionary Landing,3/11/2009 0:00,No damage,BUSINESS,West Virginia,Climb,None,FALSE,FALSE,NO DMG. NOISE HEARD IN CLIMB PHASE. BLOOD OBSERVED ON COPILOTS WINDSCREEN. PRECAUTIONARY LANDING TO ASSESS ANY DMG. NO DMG. A/C TAXIED TO RAMP W/O INCIDENT,Small,Some Cloud,Unknown bird - small,158,"5,000",0,No
268946,Airplane,MANCHESTER AIRPORT,< 1000 ft,EMB-170,1,1,None,3/11/2009 0:00,No damage,REPUBLIC AIRLINES,New Hampshire,Take-off run,None,TRUE,FALSE,UNKNOWN DMG TO A/C. A/C CONT TO KCLT. CALLED USAIR OPS ABOUT BIRDSTRIKE THEY STATE THEY DID NOT KNOW ABOUT THIS BIRDSTRIKE.,Small,Overcast,Mourning dove,0,0,0,No
268690,Airplane,MIAMI INTL,< 1000 ft,B-737-800,1,1,None,3/11/2009 0:00,No damage,AMERICAN AIRLINES,Florida,Approach,None,TRUE,FALSE,NO DMG.,Medium,No Cloud,Unknown bird - medium,0,"1,000",0,Yes
268689,Airplane,HONOLULU INTL ARPT,< 1000 ft,B-737-200,1,1,None,3/11/2009 0:00,No damage,ALOHA AIR CARGO,Hawaii,Landing Roll,Rain,TRUE,TRUE,ID BY SMITHSONIAN. FAA 3901. WHOLE FEATHER.,Small,Overcast,Pacific golden-plover,0,0,0,Yes
269182,Airplane,ATLANTA INTL,> 1000 ft,CL-RJ100/200,1,1,None,3/11/2009 0:00,No damage,ATLANTIC SOUTHEAST,Georgia,Approach,None,FALSE,FALSE,REPTD A BIRDSTRIKE AT 5000 FT WHILE INBOUND RWY 26.,Small,No Cloud,Unknown bird - small,0,"5,000",0,No
269522,Airplane,SAN DIEGO INTL,< 1000 ft,A-320,1,1,None,4/11/2009 0:00,No damage,UNITED AIRLINES,California,Approach,None,FALSE,FALSE,"ON SHORT FINAL, LRG BIRD HIT L WING LEADING EDGE. LOTS OF BLOOD AND GUTS. INSPN BY LOCAL MX. NO OBSVD DMG.",Large,Some Cloud,Unknown bird - large,0,200,0,No
269487,Airplane,CHARLOTTE/DOUGLAS INTL ARPT,< 1000 ft,B-737-400,1,1,None,4/11/2009 0:00,No damage,US AIRWAYS,North Carolina,Climb,None,FALSE,FALSE,,Small,No Cloud,Unknown bird - small,0,50,0,Yes
268793,Airplane,LEE'S SUMMIT MUNICIPAL ARPT,< 1000 ft,C-550,1,1,None,4/11/2009 0:00,Caused damage,BUSINESS,Missouri,Approach,None,FALSE,FALSE,MODERATE DENT IN L WING LEADING EDGE ACCOMPANIED BY FEATHERS AND OTHER MATTER. PILOT SAID DAMAGE WAS SUBSTANTIAL BASED ON ICAO DEF.,Medium,No Cloud,Unknown bird - medium,"34,786",200,0,No
268835,Airplane,SHOW LOW REGIONAL ARPT,> 1000 ft,BE-99,1,1,Precautionary Landing,4/11/2009 0:00,Caused damage,AMERIFLIGHT,Arizona,Descent,None,TRUE,TRUE,"ID BY SMITHSONIAN, FAA 3858. MICRO, WHOLE FEAHER & DNA. A/C WAS ON DESCENT INTO SHOWLOW, AZ AT 11,000 MSL (APPROX 6800 FEET AGL) WHEN A BIRD BROKE THRU THE WINDSHLD HITTING THE PILOT IN THE FACE AND SHOULDER. PILOT WENT TO THE HOSPITAL FOR FACIAL  & CHEST",Medium,No Cloud,Western grebe,0,"4,200",0,No
269043,Airplane,ORMOND BEACH MUNICIPAL ARPT,< 1000 ft,PA-28,1,1,None,4/11/2009 0:00,Caused damage,BUSINESS,Florida,Approach,None,FALSE,FALSE,ATIS WARNING. 3 NM NW OF OMN ARPT. LARGE DENT ON PILOT SIDE LEADING EDGE TOWARD WING TIP.,Large,Some Cloud,Turkey vulture,527,800,0,No
269521,Airplane,BALDWIN COUNTY ARPT,< 1000 ft,C-560,1,1,None,4/11/2009 0:00,Caused damage,BUSINESS,Georgia,Climb,None,FALSE,FALSE,DENTED @ 2 ENG INLET RING. BIRD WAS MEDIUM SIZE WITH GRAY FEATHERS.,Medium,No Cloud,Unknown bird - medium,"11,097","1,000",0,No
268095,Airplane,GREATER PITTSBURGH,< 1000 ft,DC-9-30,1,1,None,5/11/2009 0:00,No damage,NORTHWEST AIRLINES,Pennsylvania,Approach,None,FALSE,FALSE,BLACK BIRD.,Small,Some Cloud,Blackbirds,0,200,0,No
269368,Airplane,CHICAGO MIDWAY INTL ARPT,> 1000 ft,B-737-700,1,1,None,5/11/2009 0:00,No damage,SOUTHWEST AIRLINES,Illinois,Descent,None,FALSE,FALSE,"22 MI SW MDW. BIRD STRUCK BOTTOM OF FRWD FUSELAGE. NEVER SAW THE BIRD BEFORE IMPACT. SIZE OF BIRD, MEDIUM, IS ONLY ESTIMATED BY THE LOUDNESS OF THE ""DOINK"" ANAD THAT WE FELT THE IMPACT.",Medium,No Cloud,Unknown bird - medium,0,"5,500",0,Yes
268124,Airplane,GEORGE BUSH INTERCONTINENTAL,< 1000 ft,EMB-145,1,1,None,5/11/2009 0:00,No damage,EXPRESSJET (CONTINENTAL EXPRS),Texas,Landing Roll,None,TRUE,FALSE,RESPONDED TO 26R AFTER FLT 2335 REPTD STRIKING BIRDS ON LDG. RWY INSPN FOUND CARCASS. A/C INSPN FOUND BY COEX MECHANIC AND NO DMG REPTD.,Small,Some Cloud,Killdeer,0,0,0,No
269489,Airplane,DETROIT METRO WAYNE COUNTY ARPT,< 1000 ft,DC-9-40,1,1,None,5/11/2009 0:00,No damage,DELTA AIR LINES,Michigan,Take-off run,None,TRUE,FALSE,REMVD ONE AMER KESTREL FROM RWY 22L AT TWY Y-12. A/C DID NOT RETURN TO DTW AFTER STRIKE AND REPTD NO DMG.,Small,Some Cloud,American kestrel,0,0,0,No
269364,Airplane,DENTON MUNICIPAL ARPT,< 1000 ft,C-172,1,1,Aborted Take-off,5/11/2009 0:00,Caused damage,BUSINESS,Texas,Take-off run,None,FALSE,FALSE,"DURING INSTRUCTIONAL FLT JUST BEFORE ROTATION A/C STRUCK A DEER. IMPACT DENTED L SIDE OF ENG COWLING  PROP, COWL AND BOTTOM OF FUSELAGE. ALSO DAMAGED EXHAUST PIPE. A/C WAS BROUGHT TO A STOP ON THE RWY.   DMG REPTD AS MINOR ON ASIAS REPT. OTHER COST WAS FO",Large,No Cloud,White-tailed deer,"44,273",0,0,No
268484,Airplane,NEWARK LIBERTY INTL ARPT,< 1000 ft,A-320,1,1,None,6/11/2009 0:00,No damage,US AIRWAYS,New Jersey,Climb,None,FALSE,FALSE,ATIS WARNING.,Medium,Some Cloud,Unknown bird - medium,0,200,0,No
268485,Airplane,BALTIMORE WASH INTL,> 1000 ft,EMB-190,1,1,None,6/11/2009 0:00,No damage,US AIRWAYS,Maryland,Climb,None,FALSE,FALSE,A SINGLE BIRD STRUCK FRONT L LOWER NOSE OF A/C WITH NO DMG OTHER THAN SMALL SCRATCH. A/C LANDED SAFELY AT DEST KPHL. 4 NM FROM KBWI.,Medium,No Cloud,Unknown bird - medium,0,"2,500",0,No
268481,Airplane,JOHN F KENNEDY INTL,> 1000 ft,A-320,1,1,None,6/11/2009 0:00,No damage,JETBLUE AIRWAYS,New York,Descent,None,FALSE,FALSE,"ATIS WARNING. 10 MILES S WHILE TURNING TO LAND ON 4R. CAPT SIDE WINDOW. LOUD IMPACT, REMAINS ON SIDE WINDOW CLEARLY VISIBLE. REMAINS ISOLATED TO WINDOW.",Medium,No Cloud,Unknown bird - medium,0,"6,000",0,No
269507,Airplane,PORTLAND INTL (OR),< 1000 ft,B-737-700,1,1,None,6/11/2009 0:00,No damage,SOUTHWEST AIRLINES,Oregon,Take-off run,Rain,TRUE,FALSE,CARCASS REPTD AS FOD ON RWY. STRIKE MAY HAVE OCCURRED WITH SWA FLT 2371.  (DATA ENTRY NOTE: AIRLINE DID NOT HAVE ANY RECORD OF THIS STRIKE. DAILY REPORT SHOWS FLT 2371 HIT GULL ON DEPTR 28L. NO REPTD DMG.) ARPT CONFIRMS THIS WAS A REPORTED STRIKE.,Medium,Overcast,Glaucous-winged gull,0,0,0,Yes
269641,Airplane,CHICAGO O'HARE INTL ARPT,< 1000 ft,MD-83,1,1,None,6/11/2009 0:00,No damage,AMERICAN AIRLINES,Illinois,Landing Roll,None,TRUE,FALSE,SPARROW HAWK.,Small,Some Cloud,American kestrel,0,0,0,No
269505,Airplane,NEWARK LIBERTY INTL ARPT,< 1000 ft,DHC8 DASH 8,1,1,None,6/11/2009 0:00,No damage,COMMUTAIR,New Jersey,Approach,None,TRUE,TRUE,"ID BY SMITHSONIAN, FAA 3886. WHOLE FEATHER. PILOT REPTD HITTING A MED SIZED BIRD ABOUT 100 FT OVER BEGINNING OF THRESHOLD. HIT RT SIDE OF NOSE AND SOME SPLATTER ON RT ENG AND ON LE OF RT WING. NO DEBRIS FOUND ON RWY.",Small,No Cloud,American robin,0,100,0,No
269504,Airplane,DALLAS/FORT WORTH INTL ARPT,< 1000 ft,B-757-300,1,1,None,6/11/2009 0:00,No damage,AMERICAN AIRLINES,Texas,Landing Roll,None,TRUE,TRUE,"ID BY SMITHSONIAN, FAA 3862. WHOLE FEATHER.  PIREP THAT FLT LANDED ON 17C AND HIT A BIRD. 1 KILLDEER RECOVERED BY P110 G MILLAGE ON RWY 17C.. A/C INSPN BY MX AT GATE. NO DMG RETPD. ANOTHER REPT SAID UNCONFIRMED LOCATION OF STRIKE, SNARGE COLLECTED BY MX.",Small,Some Cloud,Killdeer,0,0,0,Yes
269506,Airplane,BURLINGTON INTL,> 1000 ft,EMB-190,1,1,None,6/11/2009 0:00,No damage,JETBLUE AIRWAYS,Vermont,Approach,None,TRUE,TRUE,"ID BY SMITHSONIAN, FAA 3875. DNA. ATIS WARNING. SAW SML BIRD TRYING TO DIVE UNDER A/C ON ILS FINAL TO WY 33 ABOUT 7 MILES FROM FIELD. NO IMMEDIATE EFFECTS NOTED. ON POST-FLT WALKAROUND, SAW REMAINS ON OUTBOARD NACELLE OF #1 ENG. TIME OUT OF SERVICE = 1/2",Small,Overcast,Horned lark,0,"2,000",0,No
266861,Airplane,SACRAMENTO INTL,< 1000 ft,B-737-700,1,1,None,7/11/2009 0:00,No damage,SOUTHWEST AIRLINES,California,Approach,None,FALSE,FALSE,NO KNOWN DMG. APPROX TIME = 1315. NO COMMUNICATION WITH ARPT OPS.,Small,No Cloud,Unknown bird - small,0,"1,000",0,Yes
266862,Airplane,EPPLEY AIRFIELD,> 1000 ft,B-737-300,1,1,None,7/11/2009 0:00,No damage,US AIRWAYS,Nebraska,Climb,None,FALSE,FALSE,BIRDSTRIKE ON DEPT F/O SIDE WINDOW. ALL ENG AND FLT CONTROLS NORMAL.,Small,No Cloud,Unknown bird - small,0,"1,500",0,Yes
266860,Airplane,MINETA SAN JOSE INTL,> 1000 ft,B-737-700,1,1,None,7/11/2009 0:00,No damage,SOUTHWEST AIRLINES,California,Approach,None,FALSE,FALSE,NO DMG. 6 MI SOUTH.,Small,No Cloud,Unknown bird - small,0,"3,000",0,Yes
269854,Airplane,DENVER INTL AIRPORT,> 1000 ft,CL-RJ700,1,1,None,7/11/2009 0:00,No damage,SKYWEST AIRLINES,Colorado,Approach,None,FALSE,FALSE,ATIS WARNING. SHORT FINAL. SMALL-MED BIRD PIGEON SIZED.,Medium,No Cloud,Unknown bird - medium,0,"1,500",0,No
265815,Airplane,FORT LAUDERDALE/HOLLYWOOD INTL,< 1000 ft,B-737-800,1,1,None,7/11/2009 0:00,No damage,AMERICAN AIRLINES,Florida,Landing Roll,None,TRUE,FALSE,ARRIVING A/C SAW AND STRUCK CATTLE EGRET ON RT SIDE OF A/C DURING LDG FLARE. FLT CREW IS UNCERTAIN IF WING OR LDG GEAR WAS STRUCK (DATA ENTRY NOTE: CAPT FILED REPORT SHOWING WING STRUCK). ARPT OPS FOUND REMAINS ON L SHOULDER OF 9L AT AREA OF RWY DESCRIBED,Small,Some Cloud,Cattle egret,0,0,0,Yes
269528,Airplane,LIHUE ARPT,< 1000 ft,B-717-200,1,1,None,7/11/2009 0:00,No damage,HAWAIIAN AIR,Hawaii,Landing Roll,None,TRUE,TRUE,"ID BY SMITHSONIAN, FAA 3900 MICRO AND DNA. ONLY ABLE TO IDENTIFY TO FAMILY - PLOVERS. ID BY WS TECH WHO FOUND CARCASS. BIRD HIT AFT OF F/O'S CLEARVIEW WINDOW AS A/C WAS ROLLING OUT.",Small,Some Cloud,Pacific golden-plover,0,0,0,No
269460,Airplane,DENVER INTL AIRPORT,< 1000 ft,A-318,1,1,None,8/11/2009 0:00,No damage,FRONTIER AIRLINES,Colorado,Approach,None,FALSE,FALSE,ATIS WARNING. DIST FROM ARPT REPTD AS 3KM.,Small,No Cloud,Unknown bird - small,0,500,0,No
269785,Airplane,SACRAMENTO INTL,< 1000 ft,B-737-300,1,1,None,8/11/2009 0:00,No damage,SOUTHWEST AIRLINES,California,Approach,None,FALSE,FALSE,ALINE NOTIFIED ARPT OPS. NO REMAINS AVAIL FOR ID OF SPECIES.,Small,No Cloud,Unknown bird - small,0,750,0,Yes
269508,Airplane,DETROIT METRO WAYNE COUNTY ARPT,< 1000 ft,B-737-300,1,1,None,8/11/2009 0:00,No damage,SOUTHWEST AIRLINES,Michigan,Approach,None,FALSE,FALSE,BLACK BIRD.,Small,No Cloud,Blackbirds,0,120,0,Yes
269461,Airplane,WESTCHESTER COUNTY ARPT,> 1000 ft,EMB-190,1,1,None,8/11/2009 0:00,No damage,JETBLUE AIRWAYS,New York,Approach,None,FALSE,FALSE,"10 (SE) MILES OUT OVER LONG ISLAND SOUND. PILOTS UNAWARE OF STRIKE UNTIL POSTFLT INSPN. DUE TO ANGLE TO SNARGE, PILOTS DEDUCED STRIKE PROBABLY ON APRCH. MX ON SITE STATED NO DMG. OPERATIONS WENT BACK TO NORMAL.",Small,No Cloud,Unknown bird - small,0,"3,500",0,No
269458,Airplane,SAN ANTONIO INTL,< 1000 ft,B-737-900,1,1,None,8/11/2009 0:00,No damage,CONTINENTAL AIRLINES,Texas,Take-off run,None,TRUE,FALSE,ATCT REPTD STRIKE TO ARPT OPS. OPS RESPONDED AND FOUND BIRD JUST E OF TWY BRAVO ON NORTHERN HALF OF RWY 12R/30L. CREWOF A/C DID NOT REPT DMG TO A/C OR WHERE IT HIT A/C. ARPT OPS PERSONNEL CONTACTED CPA OPS OFFICE AT SAT AND ADVISED THEM OF TYPE OF BIRD A/,Small,Overcast,American kestrel,0,0,0,Yes
268044,Airplane,DALLAS/FORT WORTH INTL ARPT,< 1000 ft,MD-82,1,1,None,8/11/2009 0:00,No damage,AMERICAN AIRLINES,Texas,Landing Roll,None,TRUE,TRUE,"ID BY SMITHSONIAN. FAA 3878. DNA. NOTHING FOUND ON RWY. SMALL REMAINS COLLECTED FROM A/C AT GATE. HIT R SIDE OF NOSE THEN R WING ROOT SLAT. DATA ENTRY NOTE: # STRUCK NOT REPTD, ASSUME 1.",Small,Some Cloud,Western meadowlark,0,0,0,No
268976,Airplane,LAGUARDIA NY,> 1000 ft,B-757-200,1,1,None,8/11/2009 0:00,No damage,DELTA AIR LINES,New York,Approach,None,TRUE,TRUE,"ID BY SMITHSONIAN, FAA 3934. DNA. PILOT REPTD SEEING A LRG BIRD AND THEN HEARING A HARD HIT TO A/C. A/C WAS 3 MILES NOR OF MANHATTAN. MX FOR DAL REPTD NO DMG. COM CENTER NOTIFIED.",Small,Some Cloud,American robin,0,"5,000",0,Yes
269818,Airplane,KANSAS CITY INTL,< 1000 ft,BE-1900,1,1,None,9/11/2009 0:00,No damage,GREAT LAKES AIRLINES,Missouri,Approach,None,FALSE,FALSE,NO VISIBLE DMG. BIRD REMAINS FOUND ON NOSEWHEEL GEAR DOOR. BIRD REPTD AS SMALL WITH WHITE PLUMAGE.,Small,Overcast,Unknown bird - small,0,500,0,No
268135,Airplane,NEW ORLEANS INTL,< 1000 ft,B-737-700,1,1,None,9/11/2009 0:00,No damage,SOUTHWEST AIRLINES,Louisiana,Approach,None,FALSE,FALSE,SMALL BIRD STRIKE R WING.,Small,Overcast,Unknown bird - small,0,100,0,Yes
269817,Airplane,DALLAS/FORT WORTH INTL ARPT,> 1000 ft,B-737-800,1,1,None,9/11/2009 0:00,No damage,AMERICAN AIRLINES,Texas,Climb,None,FALSE,FALSE,,Medium,No Cloud,Unknown bird - medium,0,"4,400",0,Yes
268137,Airplane,BALTIMORE WASH INTL,< 1000 ft,B-717-200,1,1,None,10/11/2009 0:00,No damage,AIRTRAN AIRWAYS,Maryland,Climb,None,FALSE,FALSE,WITHIN 2 MINUTES AFTER T/O. UPON ARRIVAL IN KMKE BIRDSTRIKE WAS DETECTED AND INSPECTED.,Large,No Cloud,Unknown bird - large,0,"1,000",0,No
269271,Airplane,AUSTIN-BERGSTROM INTL,> 1000 ft,B-737-300,1,1,None,10/11/2009 0:00,No damage,SOUTHWEST AIRLINES,Texas,Approach,None,FALSE,FALSE,CAPT REPTD STRIKE AFTER FLYING THROUGH/NEAR MOURNING DOVES. NORTH AMER MX PERSONNEL COULD NOT FIND INDICATION OF STRIKE (IMPACT SPOT OR REMAINS). BOTH CREW MEMBERS HEARD STRIKE.,Small,Some Cloud,Mourning dove,0,"1,500",0,Yes
